SNo,ObservationDate,Province/State,Country/Region,Last Update,Confirmed,Deaths,Recovered
1,01/22/2020,Anhui,Mainland China,1/22/2020 17:00,1.0,0.0,0.0
2,01/22/2020,Beijing,Mainland China,1/22/2020 17:00,14.0,0.0,0.0
3,01/22/2020,Chongqing,Mainland China,1/22/2020 17:00,6.0,0.0,0.0
4,01/22/2020,Fujian,Mainland China,1/22/2020 17:00,1.0,0.0,0.0
5,01/22/2020,Gansu,Mainland China,1/22/2020 17:00,0.0,0.0,0.0
6,01/22/2020,Guangdong,Mainland China,1/22/2020 17:00,26.0,0.0,0.0
7,01/22/2020,Guangxi,Mainland China,1/22/2020 17:00,2.0,0.0,0.0
8,01/22/2020,Guizhou,Mainland China,1/22/2020 17:00,1.0,0.0,0.0
9,01/22/2020,Hainan,Mainland China,1/22/2020 17:00,4.0,0.0,0.0
10,01/22/2020,Hebei,Mainland China,1/22/2020 17:00,1.0,0.0,0.0
11,01/22/2020,Heilongjiang,Mainland China,1/22/2020 17:00,0.0,0.0,0.0
12,01/22/2020,Henan,Mainland China,1/22/2020 17:00,5.0,0.0,0.0
13,01/22/2020,Hong Kong,Hong Kong,1/22/2020 17:00,0.0,0.0,0.0
14,01/22/2020,Hubei,Mainland China,1/22/2020 17:00,444.0,17.0,28.0
15,01/22/2020,Hunan,Mainland China,1/22/2020 17:00,4.0,0.0,0.0
16,01/22/2020,Inner Mongolia,Mainland China,1/22/2020 17:00,0.0,0.0,0.0
17,01/22/2020,Jiangsu,Mainland China,1/22/2020 17:00,1.0,0.0,0.0
18,01/22/2020,Jiangxi,Mainland China,1/22/2020 17:00,2.0,0.0,0.0
19,01/22/2020,Jilin,Mainland China,1/22/2020 17:00,0.0,0.0,0.0
20,01/22/2020,Liaoning,Mainland China,1/22/2020 17:00,2.0,0.0,0.0
21,01/22/2020,Macau,Macau,1/22/2020 17:00,1.0,0.0,0.0
22,01/22/2020,Ningxia,Mainland China,1/22/2020 17:00,1.0,0.0,0.0
23,01/22/2020,Qinghai,Mainland China,1/22/2020 17:00,0.0,0.0,0.0
24,01/22/2020,Shaanxi,Mainland China,1/22/2020 17:00,0.0,0.0,0.0
25,01/22/2020,Shandong,Mainland China,1/22/2020 17:00,2.0,0.0,0.0
26,01/22/2020,Shanghai,Mainland China,1/22/2020 17:00,9.0,0.0,0.0
27,01/22/2020,Shanxi,Mainland China,1/22/2020 17:00,1.0,0.0,0.0
28,01/22/2020,Sichuan,Mainland China,1/22/2020 17:00,5.0,0.0,0.0
29,01/22/2020,Taiwan,Taiwan,1/22/2020 17:00,1.0,0.0,0.0
30,01/22/2020,Tianjin,Mainland China,1/22/2020 17:00,4.0,0.0,0.0
31,01/22/2020,Tibet,Mainland China,1/22/2020 17:00,0.0,0.0,0.0
32,01/22/2020,Washington,US,1/22/2020 17:00,1.0,0.0,0.0
33,01/22/2020,Xinjiang,Mainland China,1/22/2020 17:00,0.0,0.0,0.0
34,01/22/2020,Yunnan,Mainland China,1/22/2020 17:00,1.0,0.0,0.0
35,01/22/2020,Zhejiang,Mainland China,1/22/2020 17:00,10.0,0.0,0.0
36,01/22/2020,,Japan,1/22/2020 17:00,2.0,0.0,0.0
37,01/22/2020,,Thailand,1/22/2020 17:00,2.0,0.0,0.0
38,01/22/2020,,South Korea,1/22/2020 17:00,1.0,0.0,0.0
39,01/23/2020,Anhui,Mainland China,1/23/20 17:00,9.0,0.0,0.0
40,01/23/2020,Beijing,Mainland China,1/23/20 17:00,22.0,0.0,0.0
41,01/23/2020,Chongqing,Mainland China,1/23/20 17:00,9.0,0.0,0.0
42,01/23/2020,Fujian,Mainland China,1/23/20 17:00,5.0,0.0,0.0
43,01/23/2020,Gansu,Mainland China,1/23/20 17:00,2.0,0.0,0.0
44,01/23/2020,Guangdong,Mainland China,1/23/20 17:00,32.0,0.0,2.0
45,01/23/2020,Guangxi,Mainland China,1/23/20 17:00,5.0,0.0,0.0
46,01/23/2020,Guizhou,Mainland China,1/23/20 17:00,3.0,0.0,0.0
47,01/23/2020,Hainan,Mainland China,1/23/20 17:00,5.0,0.0,0.0
48,01/23/2020,Hebei,Mainland China,1/23/20 17:00,1.0,1.0,0.0
49,01/23/2020,Heilongjiang,Mainland China,1/23/20 17:00,2.0,0.0,0.0
50,01/23/2020,Henan,Mainland China,1/23/20 17:00,5.0,0.0,0.0
51,01/23/2020,Hong Kong,Hong Kong,1/23/20 17:00,2.0,0.0,0.0
52,01/23/2020,Hubei,Mainland China,1/23/20 17:00,444.0,17.0,28.0
53,01/23/2020,Hunan,Mainland China,1/23/20 17:00,9.0,0.0,0.0
54,01/23/2020,Inner Mongolia,Mainland China,1/23/20 17:00,0.0,0.0,0.0
55,01/23/2020,Jiangsu,Mainland China,1/23/20 17:00,5.0,0.0,0.0
56,01/23/2020,Jiangxi,Mainland China,1/23/20 17:00,7.0,0.0,0.0
57,01/23/2020,Jilin,Mainland China,1/23/20 17:00,1.0,0.0,0.0
58,01/23/2020,Liaoning,Mainland China,1/23/20 17:00,3.0,0.0,0.0
59,01/23/2020,Macau,Macau,1/23/20 17:00,2.0,0.0,0.0
60,01/23/2020,Ningxia,Mainland China,1/23/20 17:00,1.0,0.0,0.0
61,01/23/2020,Qinghai,Mainland China,1/23/20 17:00,0.0,0.0,0.0
62,01/23/2020,Shaanxi,Mainland China,1/23/20 17:00,3.0,0.0,0.0
63,01/23/2020,Shandong,Mainland China,1/23/20 17:00,6.0,0.0,0.0
64,01/23/2020,Shanghai,Mainland China,1/23/20 17:00,16.0,0.0,0.0
65,01/23/2020,Shanxi,Mainland China,1/23/20 17:00,1.0,0.0,0.0
66,01/23/2020,Sichuan,Mainland China,1/23/20 17:00,8.0,0.0,0.0
67,01/23/2020,Taiwan,Taiwan,1/23/20 17:00,1.0,0.0,0.0
68,01/23/2020,Tianjin,Mainland China,1/23/20 17:00,4.0,0.0,0.0
69,01/23/2020,Tibet,Mainland China,1/23/20 17:00,0.0,0.0,0.0
70,01/23/2020,Washington,US,1/23/20 17:00,1.0,0.0,0.0
71,01/23/2020,Xinjiang,Mainland China,1/23/20 17:00,2.0,0.0,0.0
72,01/23/2020,Yunnan,Mainland China,1/23/20 17:00,2.0,0.0,0.0
73,01/23/2020,Zhejiang,Mainland China,1/23/20 17:00,27.0,0.0,0.0
74,01/23/2020,,Japan,1/23/20 17:00,1.0,0.0,0.0
75,01/23/2020,,Thailand,1/23/20 17:00,3.0,0.0,0.0
76,01/23/2020,,South Korea,1/23/20 17:00,1.0,0.0,0.0
77,01/23/2020,,Singapore,1/23/20 17:00,1.0,0.0,0.0
78,01/23/2020,,Philippines,1/23/20 17:00,0.0,0.0,0.0
79,01/23/2020,,Malaysia,1/23/20 17:00,0.0,0.0,0.0
80,01/23/2020,,Vietnam,1/23/20 17:00,2.0,0.0,0.0
81,01/23/2020,,Australia,1/23/20 17:00,0.0,0.0,0.0
82,01/23/2020,,Mexico,1/23/20 17:00,0.0,0.0,0.0
83,01/23/2020,,Brazil,1/23/20 17:00,0.0,0.0,0.0
84,01/23/2020,,Colombia,1/23/20 17:00,0.0,0.0,0.0
85,01/24/2020,Hubei,Mainland China,1/24/20 17:00,549.0,24.0,31.0
86,01/24/2020,Guangdong,Mainland China,1/24/20 17:00,53.0,0.0,2.0
87,01/24/2020,Zhejiang,Mainland China,1/24/20 17:00,43.0,0.0,1.0
88,01/24/2020,Beijing,Mainland China,1/24/20 17:00,36.0,0.0,1.0
89,01/24/2020,Chongqing,Mainland China,1/24/20 17:00,27.0,0.0,0.0
90,01/24/2020,Hunan,Mainland China,1/24/20 17:00,24.0,0.0,0.0
91,01/24/2020,Guangxi,Mainland China,1/24/20 17:00,23.0,0.0,0.0
92,01/24/2020,Shanghai,Mainland China,1/24/20 17:00,20.0,0.0,1.0
93,01/24/2020,Jiangxi,Mainland China,1/24/20 17:00,18.0,0.0,0.0
94,01/24/2020,Sichuan,Mainland China,1/24/20 17:00,15.0,0.0,0.0
95,01/24/2020,Shandong,Mainland China,1/24/20 17:00,15.0,0.0,0.0
96,01/24/2020,Anhui,Mainland China,1/24/20 17:00,15.0,0.0,0.0
97,01/24/2020,Fujian,Mainland China,1/24/20 17:00,10.0,0.0,0.0
98,01/24/2020,Henan,Mainland China,1/24/20 17:00,9.0,0.0,0.0
99,01/24/2020,Jiangsu,Mainland China,1/24/20 17:00,9.0,0.0,0.0
100,01/24/2020,Hainan,Mainland China,1/24/20 17:00,8.0,0.0,0.0
101,01/24/2020,Tianjin,Mainland China,1/24/20 17:00,8.0,0.0,0.0
102,01/24/2020,Yunnan,Mainland China,1/24/20 17:00,5.0,0.0,0.0
103,01/24/2020,Shaanxi,Mainland China,1/24/20 17:00,5.0,0.0,0.0
104,01/24/2020,Heilongjiang,Mainland China,1/24/20 17:00,4.0,1.0,0.0
105,01/24/2020,Liaoning,Mainland China,1/24/20 17:00,4.0,0.0,0.0
106,01/24/2020,Guizhou,Mainland China,1/24/20 17:00,3.0,0.0,0.0
107,01/24/2020,Jilin,Mainland China,1/24/20 17:00,3.0,0.0,0.0
108,01/24/2020,Taiwan,Taiwan,1/24/20 17:00,3.0,0.0,0.0
109,01/24/2020,Ningxia,Mainland China,1/24/20 17:00,2.0,0.0,0.0
110,01/24/2020,Hong Kong,Hong Kong,1/24/20 17:00,2.0,0.0,0.0
111,01/24/2020,Macau,Macau,1/24/20 17:00,2.0,0.0,0.0
112,01/24/2020,Hebei,Mainland China,1/24/20 17:00,2.0,1.0,0.0
113,01/24/2020,Gansu,Mainland China,1/24/20 17:00,2.0,0.0,0.0
114,01/24/2020,Xinjiang,Mainland China,1/24/20 17:00,2.0,0.0,0.0
115,01/24/2020,Shanxi,Mainland China,1/24/20 17:00,1.0,0.0,0.0
116,01/24/2020,Inner Mongolia,Mainland China,1/24/20 17:00,1.0,0.0,0.0
117,01/24/2020,Qinghai,Mainland China,1/24/20 17:00,0.0,0.0,0.0
118,01/24/2020,Washington,US,1/24/20 17:00,1.0,0.0,0.0
119,01/24/2020,Chicago,US,1/24/20 17:00,1.0,0.0,0.0
120,01/24/2020,,Japan,1/24/20 17:00,2.0,0.0,0.0
121,01/24/2020,,Thailand,1/24/20 17:00,5.0,0.0,0.0
122,01/24/2020,,South Korea,1/24/20 17:00,2.0,0.0,0.0
123,01/24/2020,,Singapore,1/24/20 17:00,3.0,0.0,0.0
124,01/24/2020,,Vietnam,1/24/20 17:00,2.0,0.0,0.0
125,01/24/2020,,France,1/24/20 17:00,2.0,0.0,0.0
126,01/25/2020,Hubei,Mainland China,1/25/20 17:00,761.0,40.0,32.0
127,01/25/2020,Guangdong,Mainland China,1/25/20 17:00,78.0,0.0,2.0
128,01/25/2020,Zhejiang,Mainland China,1/25/20 17:00,62.0,0.0,1.0
129,01/25/2020,Chongqing,Mainland China,1/25/20 17:00,57.0,0.0,0.0
130,01/25/2020,Hunan,Mainland China,1/25/20 17:00,43.0,0.0,0.0
131,01/25/2020,Beijing,Mainland China,1/25/20 17:00,41.0,0.0,2.0
132,01/25/2020,Anhui,Mainland China,1/25/20 17:00,39.0,0.0,0.0
133,01/25/2020,Shanghai,Mainland China,1/25/20 17:00,33.0,0.0,1.0
134,01/25/2020,Henan,Mainland China,1/25/20 17:00,32.0,0.0,0.0
135,01/25/2020,Sichuan,Mainland China,1/25/20 17:00,28.0,0.0,0.0
136,01/25/2020,Shandong,Mainland China,1/25/20 17:00,27.0,0.0,0.0
137,01/25/2020,Guangxi,Mainland China,1/25/20 17:00,23.0,0.0,0.0
138,01/25/2020,Hainan,Mainland China,1/25/20 17:00,19.0,0.0,0.0
139,01/25/2020,Jiangxi,Mainland China,1/25/20 17:00,18.0,0.0,0.0
140,01/25/2020,Fujian,Mainland China,1/25/20 17:00,18.0,0.0,0.0
141,01/25/2020,Jiangsu,Mainland China,1/25/20 17:00,18.0,0.0,1.0
142,01/25/2020,Liaoning,Mainland China,1/25/20 17:00,17.0,0.0,0.0
143,01/25/2020,Shaanxi,Mainland China,1/25/20 17:00,15.0,0.0,0.0
144,01/25/2020,Yunnan,Mainland China,1/25/20 17:00,11.0,0.0,0.0
145,01/25/2020,Tianjin,Mainland China,1/25/20 17:00,10.0,0.0,0.0
146,01/25/2020,Heilongjiang,Mainland China,1/25/20 17:00,9.0,1.0,0.0
147,01/25/2020,Hebei,Mainland China,1/25/20 17:00,8.0,1.0,0.0
148,01/25/2020,Inner Mongolia,Mainland China,1/25/20 17:00,7.0,0.0,0.0
149,01/25/2020,Shanxi,Mainland China,1/25/20 17:00,6.0,0.0,0.0
150,01/25/2020,Hong Kong,Hong Kong,1/25/20 17:00,5.0,0.0,0.0
151,01/25/2020,Guizhou,Mainland China,1/25/20 17:00,4.0,0.0,0.0
152,01/25/2020,Jilin,Mainland China,1/25/20 17:00,4.0,0.0,0.0
153,01/25/2020,Gansu,Mainland China,1/25/20 17:00,4.0,0.0,0.0
154,01/25/2020,Ningxia,Mainland China,1/25/20 17:00,3.0,0.0,0.0
155,01/25/2020,Taiwan,Taiwan,1/25/20 17:00,3.0,0.0,0.0
156,01/25/2020,Xinjiang,Mainland China,1/25/20 17:00,3.0,0.0,0.0
157,01/25/2020,Macau,Macau,1/25/20 17:00,2.0,0.0,0.0
158,01/25/2020,Qinghai,Mainland China,1/25/20 17:00,1.0,0.0,0.0
159,01/25/2020,Washington,US,1/25/20 17:00,1.0,0.0,0.0
160,01/25/2020,Illinois,US,1/25/20 17:00,1.0,0.0,0.0
161,01/25/2020,,Japan,1/25/20 17:00,2.0,0.0,0.0
162,01/25/2020,,Thailand,1/25/20 17:00,7.0,0.0,0.0
163,01/25/2020,,South Korea,1/25/20 17:00,2.0,0.0,0.0
164,01/25/2020,,Singapore,1/25/20 17:00,3.0,0.0,0.0
165,01/25/2020,,Vietnam,1/25/20 17:00,2.0,0.0,0.0
166,01/25/2020,,France,1/25/20 17:00,3.0,0.0,0.0
167,01/25/2020,,Australia,1/25/20 17:00,4.0,0.0,0.0
168,01/25/2020,,Nepal,1/25/20 17:00,1.0,0.0,0.0
169,01/25/2020,,Malaysia,1/25/20 17:00,3.0,0.0,0.0
170,01/26/2020,Hubei,Mainland China,1/26/20 16:00,1058.0,52.0,42.0
171,01/26/2020,Guangdong,Mainland China,1/26/20 16:00,111.0,0.0,2.0
172,01/26/2020,Zhejiang,Mainland China,1/26/20 16:00,104.0,0.0,1.0
173,01/26/2020,Henan,Mainland China,1/26/20 16:00,83.0,1.0,0.0
174,01/26/2020,Chongqing,Mainland China,1/26/20 16:00,75.0,0.0,0.0
175,01/26/2020,Hunan,Mainland China,1/26/20 16:00,69.0,0.0,0.0
176,01/26/2020,Beijing,Mainland China,1/26/20 16:00,68.0,0.0,2.0
177,01/26/2020,Anhui,Mainland China,1/26/20 16:00,60.0,0.0,0.0
178,01/26/2020,Shandong,Mainland China,1/26/20 16:00,46.0,0.0,0.0
179,01/26/2020,Sichuan,Mainland China,1/26/20 16:00,44.0,0.0,0.0
180,01/26/2020,Shanghai,Mainland China,1/26/20 16:00,40.0,1.0,1.0
181,01/26/2020,Guangxi,Mainland China,1/26/20 16:00,36.0,0.0,0.0
182,01/26/2020,Jiangxi,Mainland China,1/26/20 16:00,36.0,0.0,0.0
183,01/26/2020,Fujian,Mainland China,1/26/20 16:00,35.0,0.0,0.0
184,01/26/2020,Jiangsu,Mainland China,1/26/20 16:00,33.0,0.0,1.0
185,01/26/2020,Hainan,Mainland China,1/26/20 16:00,22.0,0.0,0.0
186,01/26/2020,Shaanxi,Mainland China,1/26/20 16:00,22.0,0.0,0.0
187,01/26/2020,Liaoning,Mainland China,1/26/20 16:00,21.0,0.0,0.0
188,01/26/2020,Yunnan,Mainland China,1/26/20 16:00,16.0,0.0,0.0
189,01/26/2020,Heilongjiang,Mainland China,1/26/20 16:00,15.0,1.0,0.0
190,01/26/2020,Tianjin,Mainland China,1/26/20 16:00,14.0,0.0,0.0
191,01/26/2020,Hebei,Mainland China,1/26/20 16:00,13.0,1.0,0.0
192,01/26/2020,Shanxi,Mainland China,1/26/20 16:00,9.0,0.0,0.0
193,01/26/2020,Hong Kong,Hong Kong,1/26/20 16:00,8.0,0.0,0.0
194,01/26/2020,Inner Mongolia,Mainland China,1/26/20 16:00,7.0,0.0,0.0
195,01/26/2020,Gansu,Mainland China,1/26/20 16:00,7.0,0.0,0.0
196,01/26/2020,Guizhou,Mainland China,1/26/20 16:00,5.0,0.0,0.0
197,01/26/2020,Macau,Macau,1/26/20 16:00,5.0,0.0,0.0
198,01/26/2020,Ningxia,Mainland China,1/26/20 16:00,4.0,0.0,0.0
199,01/26/2020,Jilin,Mainland China,1/26/20 16:00,4.0,0.0,0.0
200,01/26/2020,Taiwan,Taiwan,1/26/20 16:00,4.0,0.0,0.0
201,01/26/2020,Xinjiang,Mainland China,1/26/20 16:00,4.0,0.0,0.0
202,01/26/2020,Qinghai,Mainland China,1/26/20 16:00,1.0,0.0,0.0
203,01/26/2020,Washington,US,1/26/20 16:00,1.0,0.0,0.0
204,01/26/2020,Illinois,US,1/26/20 16:00,1.0,0.0,0.0
205,01/26/2020,California,US,1/26/20 16:00,2.0,0.0,0.0
206,01/26/2020,Arizona,US,1/26/20 16:00,1.0,0.0,0.0
207,01/26/2020,,Japan,1/26/20 16:00,4.0,0.0,1.0
208,01/26/2020,,Thailand,1/26/20 16:00,8.0,0.0,2.0
209,01/26/2020,,South Korea,1/26/20 16:00,3.0,0.0,0.0
210,01/26/2020,,Singapore,1/26/20 16:00,4.0,0.0,0.0
211,01/26/2020,,Vietnam,1/26/20 16:00,2.0,0.0,0.0
212,01/26/2020,,France,1/26/20 16:00,3.0,0.0,0.0
213,01/26/2020,,Australia,1/26/20 16:00,4.0,0.0,0.0
214,01/26/2020,,Nepal,1/26/20 16:00,1.0,0.0,0.0
215,01/26/2020,,Malaysia,1/26/20 16:00,4.0,0.0,0.0
216,01/26/2020,Ontario,Canada,1/26/20 16:00,1.0,0.0,0.0
217,01/27/2020,Hubei,Mainland China,1/27/20 23:59,1423.0,76.0,45.0
218,01/27/2020,Guangdong,Mainland China,1/27/20 23:59,151.0,0.0,4.0
219,01/27/2020,Zhejiang,Mainland China,1/27/20 23:59,128.0,0.0,1.0
220,01/27/2020,Henan,Mainland China,1/27/20 23:59,128.0,1.0,0.0
221,01/27/2020,Chongqing,Mainland China,1/27/20 23:59,110.0,0.0,0.0
222,01/27/2020,Hunan,Mainland China,1/27/20 23:59,100.0,0.0,0.0
223,01/27/2020,Beijing,Mainland China,1/27/20 23:59,80.0,1.0,2.0
224,01/27/2020,Shandong,Mainland China,1/27/20 23:59,75.0,0.0,0.0
225,01/27/2020,Jiangxi,Mainland China,1/27/20 23:59,72.0,0.0,2.0
226,01/27/2020,Anhui,Mainland China,1/27/20 23:59,70.0,0.0,0.0
227,01/27/2020,Sichuan,Mainland China,1/27/20 23:59,69.0,0.0,0.0
228,01/27/2020,Fujian,Mainland China,1/27/20 23:59,59.0,0.0,0.0
229,01/27/2020,Shanghai,Mainland China,1/27/20 23:59,53.0,1.0,3.0
230,01/27/2020,Jiangsu,Mainland China,1/27/20 23:59,47.0,0.0,1.0
231,01/27/2020,Guangxi,Mainland China,1/27/20 23:59,46.0,0.0,0.0
232,01/27/2020,Shaanxi,Mainland China,1/27/20 23:59,35.0,0.0,0.0
233,01/27/2020,Hainan,Mainland China,1/27/20 23:59,33.0,1.0,0.0
234,01/27/2020,Liaoning,Mainland China,1/27/20 23:59,27.0,0.0,0.0
235,01/27/2020,Yunnan,Mainland China,1/27/20 23:59,26.0,0.0,0.0
236,01/27/2020,Tianjin,Mainland China,1/27/20 23:59,23.0,0.0,0.0
237,01/27/2020,Heilongjiang,Mainland China,1/27/20 23:59,21.0,1.0,0.0
238,01/27/2020,Hebei,Mainland China,1/27/20 23:59,18.0,1.0,0.0
239,01/27/2020,Gansu,Mainland China,1/27/20 23:59,14.0,0.0,0.0
240,01/27/2020,Shanxi,Mainland China,1/27/20 23:59,13.0,0.0,0.0
241,01/27/2020,Inner Mongolia,Mainland China,1/27/20 23:59,11.0,0.0,0.0
242,01/27/2020,Hong Kong,Hong Kong,1/27/20 23:59,8.0,0.0,0.0
243,01/27/2020,Guizhou,Mainland China,1/27/20 23:59,7.0,0.0,0.0
244,01/27/2020,Ningxia,Mainland China,1/27/20 23:59,7.0,0.0,0.0
245,01/27/2020,Jilin,Mainland China,1/27/20 23:59,6.0,0.0,0.0
246,01/27/2020,Macau,Macau,1/27/20 23:59,6.0,0.0,0.0
247,01/27/2020,Qinghai,Mainland China,1/27/20 23:59,6.0,0.0,0.0
248,01/27/2020,Taiwan,Taiwan,1/27/20 23:59,5.0,0.0,0.0
249,01/27/2020,Xinjiang,Mainland China,1/27/20 23:59,5.0,0.0,0.0
250,01/27/2020,Washington,US,1/27/20 23:59,1.0,0.0,0.0
251,01/27/2020,Illinois,US,1/27/20 23:59,1.0,0.0,0.0
252,01/27/2020,California,US,1/27/20 23:59,2.0,0.0,0.0
253,01/27/2020,Arizona,US,1/27/20 23:59,1.0,0.0,0.0
254,01/27/2020,,Japan,1/27/20 23:59,4.0,0.0,1.0
255,01/27/2020,,Thailand,1/27/20 23:59,8.0,0.0,2.0
256,01/27/2020,,South Korea,1/27/20 23:59,4.0,0.0,0.0
257,01/27/2020,,Singapore,1/27/20 23:59,5.0,0.0,0.0
258,01/27/2020,,Vietnam,1/27/20 23:59,2.0,0.0,0.0
259,01/27/2020,,France,1/27/20 23:59,3.0,0.0,0.0
260,01/27/2020,,Nepal,1/27/20 23:59,1.0,0.0,0.0
261,01/27/2020,,Malaysia,1/27/20 23:59,4.0,0.0,0.0
262,01/27/2020,Ontario,Canada,1/27/20 23:59,1.0,0.0,0.0
263,01/27/2020,,Cambodia,1/27/20 23:59,1.0,0.0,0.0
264,01/27/2020,,Sri Lanka,1/27/20 23:59,1.0,0.0,0.0
265,01/27/2020,,Ivory Coast,1/27/20 23:59,1.0,0.0,0.0
266,01/27/2020,New South Wales,Australia,1/27/20 23:59,4.0,0.0,0.0
267,01/27/2020,Victoria,Australia,1/27/20 23:59,1.0,0.0,0.0
268,01/28/2020,Hubei,Mainland China,1/28/20 23:00,3554.0,125.0,80.0
269,01/28/2020,Guangdong,Mainland China,1/28/20 23:00,207.0,0.0,4.0
270,01/28/2020,Zhejiang,Mainland China,1/28/20 23:00,173.0,0.0,3.0
271,01/28/2020,Henan,Mainland China,1/28/20 23:00,168.0,1.0,0.0
272,01/28/2020,Hunan,Mainland China,1/28/20 23:00,143.0,0.0,0.0
273,01/28/2020,Chongqing,Mainland China,1/28/20 23:00,132.0,0.0,0.0
274,01/28/2020,Jiangxi,Mainland China,1/28/20 23:00,109.0,0.0,3.0
275,01/28/2020,Anhui,Mainland China,1/28/20 23:00,106.0,0.0,0.0
276,01/28/2020,Shandong,Mainland China,1/28/20 23:00,95.0,0.0,0.0
277,01/28/2020,Beijing,Mainland China,1/28/20 23:00,91.0,1.0,4.0
278,01/28/2020,Sichuan,Mainland China,1/28/20 23:00,90.0,0.0,0.0
279,01/28/2020,Fujian,Mainland China,1/28/20 23:00,80.0,0.0,0.0
280,01/28/2020,Jiangsu,Mainland China,1/28/20 23:00,70.0,0.0,1.0
281,01/28/2020,Shanghai,Mainland China,1/28/20 23:00,66.0,1.0,4.0
282,01/28/2020,Guangxi,Mainland China,1/28/20 23:00,51.0,0.0,2.0
283,01/28/2020,Shaanxi,Mainland China,1/28/20 23:00,46.0,0.0,0.0
284,01/28/2020,Yunnan,Mainland China,1/28/20 23:00,44.0,0.0,0.0
285,01/28/2020,Hainan,Mainland China,1/28/20 23:00,40.0,1.0,0.0
286,01/28/2020,Liaoning,Mainland China,1/28/20 23:00,34.0,0.0,0.0
287,01/28/2020,Hebei,Mainland China,1/28/20 23:00,33.0,1.0,0.0
288,01/28/2020,Heilongjiang,Mainland China,1/28/20 23:00,33.0,1.0,0.0
289,01/28/2020,Shanxi,Mainland China,1/28/20 23:00,27.0,0.0,0.0
290,01/28/2020,Tianjin,Mainland China,1/28/20 23:00,24.0,0.0,0.0
291,01/28/2020,Gansu,Mainland China,1/28/20 23:00,19.0,0.0,0.0
292,01/28/2020,Inner Mongolia,Mainland China,1/28/20 23:00,15.0,0.0,0.0
293,01/28/2020,Ningxia,Mainland China,1/28/20 23:00,11.0,0.0,0.0
294,01/28/2020,Xinjiang,Mainland China,1/28/20 23:00,10.0,0.0,0.0
295,01/28/2020,Guizhou,Mainland China,1/28/20 23:00,9.0,0.0,0.0
296,01/28/2020,Jilin,Mainland China,1/28/20 23:00,8.0,0.0,0.0
297,01/28/2020,Taiwan,Taiwan,1/28/20 23:00,8.0,0.0,0.0
298,01/28/2020,Hong Kong,Hong Kong,1/28/20 23:00,8.0,0.0,0.0
299,01/28/2020,Macau,Macau,1/28/20 23:00,7.0,0.0,0.0
300,01/28/2020,Qinghai,Mainland China,1/28/20 23:00,6.0,0.0,0.0
301,01/28/2020,Washington,US,1/28/20 23:00,1.0,0.0,0.0
302,01/28/2020,Illinois,US,1/28/20 23:00,1.0,0.0,0.0
303,01/28/2020,California,US,1/28/20 23:00,2.0,0.0,0.0
304,01/28/2020,Arizona,US,1/28/20 23:00,1.0,0.0,0.0
305,01/28/2020,,Japan,1/28/20 23:00,7.0,0.0,1.0
306,01/28/2020,,Thailand,1/28/20 23:00,14.0,0.0,5.0
307,01/28/2020,,South Korea,1/28/20 23:00,4.0,0.0,0.0
308,01/28/2020,,Singapore,1/28/20 23:00,7.0,0.0,0.0
309,01/28/2020,,Vietnam,1/28/20 23:00,2.0,0.0,0.0
310,01/28/2020,,France,1/28/20 23:00,4.0,0.0,0.0
311,01/28/2020,,Nepal,1/28/20 23:00,1.0,0.0,0.0
312,01/28/2020,,Malaysia,1/28/20 23:00,4.0,0.0,0.0
313,01/28/2020,Ontario,Canada,1/28/20 23:00,1.0,0.0,0.0
314,01/28/2020,British Columbia,Canada,1/28/20 23:00,1.0,0.0,0.0
315,01/28/2020,,Cambodia,1/28/20 23:00,1.0,0.0,0.0
316,01/28/2020,,Sri Lanka,1/28/20 23:00,1.0,0.0,0.0
317,01/28/2020,New South Wales,Australia,1/28/20 23:00,4.0,0.0,0.0
318,01/28/2020,Victoria,Australia,1/28/20 23:00,1.0,0.0,0.0
319,01/28/2020,Bavaria,Germany,1/28/20 23:00,4.0,0.0,0.0
320,01/29/2020,Hubei,Mainland China,1/29/20 19:30,3554.0,125.0,88.0
321,01/29/2020,Zhejiang,Mainland China,1/29/20 19:30,296.0,0.0,3.0
322,01/29/2020,Guangdong,Mainland China,1/29/20 19:30,277.0,0.0,5.0
323,01/29/2020,Hunan,Mainland China,1/29/20 19:30,221.0,0.0,0.0
324,01/29/2020,Henan,Mainland China,1/29/20 19:30,206.0,2.0,1.0
325,01/29/2020,Anhui,Mainland China,1/29/20 19:30,152.0,0.0,2.0
326,01/29/2020,Chongqing,Mainland China,1/29/20 19:30,147.0,0.0,1.0
327,01/29/2020,Shandong,Mainland China,1/29/20 19:30,130.0,0.0,1.0
328,01/29/2020,Beijing,Mainland China,1/29/20 19:30,111.0,1.0,4.0
329,01/29/2020,Jiangxi,Mainland China,1/29/20 19:30,109.0,0.0,3.0
330,01/29/2020,Sichuan,Mainland China,1/29/20 19:30,108.0,1.0,1.0
331,01/29/2020,Jiangsu,Mainland China,1/29/20 19:30,99.0,0.0,1.0
332,01/29/2020,Shanghai,Mainland China,1/29/20 19:30,96.0,1.0,5.0
333,01/29/2020,Fujian,Mainland China,1/29/20 19:30,84.0,0.0,0.0
334,01/29/2020,Guangxi,Mainland China,1/29/20 19:30,58.0,0.0,2.0
335,01/29/2020,Shaanxi,Mainland China,1/29/20 19:30,56.0,0.0,0.0
336,01/29/2020,Yunnan,Mainland China,1/29/20 19:30,55.0,0.0,0.0
337,01/29/2020,Hebei,Mainland China,1/29/20 19:30,48.0,1.0,0.0
338,01/29/2020,Hainan,Mainland China,1/29/20 19:30,43.0,1.0,0.0
339,01/29/2020,Liaoning,Mainland China,1/29/20 19:30,39.0,0.0,1.0
340,01/29/2020,Heilongjiang,Mainland China,1/29/20 19:30,38.0,1.0,0.0
341,01/29/2020,Tianjin,Mainland China,1/29/20 19:30,27.0,0.0,0.0
342,01/29/2020,Shanxi,Mainland China,1/29/20 19:30,27.0,0.0,1.0
343,01/29/2020,Gansu,Mainland China,1/29/20 19:30,24.0,0.0,0.0
344,01/29/2020,Inner Mongolia,Mainland China,1/29/20 19:30,16.0,0.0,0.0
345,01/29/2020,Xinjiang,Mainland China,1/29/20 19:30,13.0,0.0,0.0
346,01/29/2020,Ningxia,Mainland China,1/29/20 19:30,12.0,0.0,0.0
347,01/29/2020,Hong Kong,Hong Kong,1/29/20 19:30,10.0,0.0,0.0
348,01/29/2020,Guizhou,Mainland China,1/29/20 19:30,9.0,0.0,1.0
349,01/29/2020,Jilin,Mainland China,1/29/20 19:30,9.0,0.0,0.0
350,01/29/2020,Taiwan,Taiwan,1/29/20 19:30,8.0,0.0,0.0
351,01/29/2020,Macau,Macau,1/29/20 19:30,7.0,0.0,0.0
352,01/29/2020,Qinghai,Mainland China,1/29/20 19:30,6.0,0.0,0.0
353,01/29/2020,Washington,US,1/29/20 19:30,1.0,0.0,0.0
354,01/29/2020,Illinois,US,1/29/20 19:30,1.0,0.0,0.0
355,01/29/2020,California,US,1/29/20 19:30,2.0,0.0,0.0
356,01/29/2020,Arizona,US,1/29/20 19:30,1.0,0.0,0.0
357,01/29/2020,,Japan,1/29/20 19:30,7.0,0.0,1.0
358,01/29/2020,,Thailand,1/29/20 19:30,14.0,0.0,5.0
359,01/29/2020,,South Korea,1/29/20 19:30,4.0,0.0,0.0
360,01/29/2020,,Singapore,1/29/20 19:30,7.0,0.0,0.0
361,01/29/2020,,Vietnam,1/29/20 19:30,2.0,0.0,0.0
362,01/29/2020,,France,1/29/20 19:30,5.0,0.0,0.0
363,01/29/2020,,Nepal,1/29/20 19:30,1.0,0.0,0.0
364,01/29/2020,,Malaysia,1/29/20 19:30,7.0,0.0,0.0
365,01/29/2020,Ontario,Canada,1/29/20 19:30,1.0,0.0,0.0
366,01/29/2020,British Columbia,Canada,1/29/20 19:30,1.0,0.0,0.0
367,01/29/2020,,Cambodia,1/29/20 19:30,1.0,0.0,0.0
368,01/29/2020,,Sri Lanka,1/29/20 19:30,1.0,0.0,0.0
369,01/29/2020,New South Wales,Australia,1/29/20 19:30,4.0,0.0,0.0
370,01/29/2020,Victoria,Australia,1/29/20 19:30,1.0,0.0,0.0
371,01/29/2020,Bavaria,Germany,1/29/20 19:30,4.0,0.0,0.0
372,01/29/2020,,Finland,1/29/20 19:30,1.0,0.0,0.0
373,01/29/2020,,United Arab Emirates,1/29/20 19:30,4.0,0.0,0.0
374,01/30/2020,Hubei,Mainland China,1/30/20 16:00,4903.0,162.0,90.0
375,01/30/2020,Zhejiang,Mainland China,1/30/20 16:00,428.0,0.0,4.0
376,01/30/2020,Guangdong,Mainland China,1/30/20 16:00,354.0,0.0,10.0
377,01/30/2020,Henan,Mainland China,1/30/20 16:00,278.0,2.0,2.0
378,01/30/2020,Hunan,Mainland China,1/30/20 16:00,277.0,0.0,2.0
379,01/30/2020,Anhui,Mainland China,1/30/20 16:00,200.0,0.0,2.0
380,01/30/2020,Chongqing,Mainland China,1/30/20 16:00,182.0,0.0,1.0
381,01/30/2020,Jiangxi,Mainland China,1/30/20 16:00,162.0,0.0,5.0
382,01/30/2020,Shandong,Mainland China,1/30/20 16:00,158.0,0.0,1.0
383,01/30/2020,Sichuan,Mainland China,1/30/20 16:00,142.0,1.0,1.0
384,01/30/2020,Jiangsu,Mainland China,1/30/20 16:00,129.0,0.0,1.0
385,01/30/2020,Beijing,Mainland China,1/30/20 16:00,114.0,1.0,4.0
386,01/30/2020,Shanghai,Mainland China,1/30/20 16:00,112.0,1.0,5.0
387,01/30/2020,Fujian,Mainland China,1/30/20 16:00,101.0,0.0,0.0
388,01/30/2020,Guangxi,Mainland China,1/30/20 16:00,78.0,0.0,2.0
389,01/30/2020,Yunnan,Mainland China,1/30/20 16:00,70.0,0.0,0.0
390,01/30/2020,Hebei,Mainland China,1/30/20 16:00,65.0,1.0,0.0
391,01/30/2020,Shaanxi,Mainland China,1/30/20 16:00,63.0,0.0,0.0
392,01/30/2020,Hainan,Mainland China,1/30/20 16:00,46.0,1.0,1.0
393,01/30/2020,Heilongjiang,Mainland China,1/30/20 16:00,44.0,2.0,0.0
394,01/30/2020,Liaoning,Mainland China,1/30/20 16:00,41.0,0.0,1.0
395,01/30/2020,Shanxi,Mainland China,1/30/20 16:00,35.0,0.0,1.0
396,01/30/2020,Tianjin,Mainland China,1/30/20 16:00,31.0,0.0,0.0
397,01/30/2020,Gansu,Mainland China,1/30/20 16:00,26.0,0.0,0.0
398,01/30/2020,Inner Mongolia,Mainland China,1/30/20 16:00,19.0,0.0,0.0
399,01/30/2020,Ningxia,Mainland China,1/30/20 16:00,17.0,0.0,0.0
400,01/30/2020,Jilin,Mainland China,1/30/20 16:00,14.0,0.0,1.0
401,01/30/2020,Xinjiang,Mainland China,1/30/20 16:00,14.0,0.0,0.0
402,01/30/2020,Guizhou,Mainland China,1/30/20 16:00,12.0,0.0,1.0
403,01/30/2020,Hong Kong,Hong Kong,1/30/20 16:00,10.0,0.0,0.0
404,01/30/2020,Taiwan,Taiwan,1/30/20 16:00,9.0,0.0,0.0
405,01/30/2020,Qinghai,Mainland China,1/30/20 16:00,8.0,0.0,0.0
406,01/30/2020,Macau,Macau,1/30/20 16:00,7.0,0.0,0.0
407,01/30/2020,Tibet,Mainland China,1/30/20 16:00,1.0,0.0,0.0
408,01/30/2020,Washington,US,1/30/20 16:00,1.0,0.0,0.0
409,01/30/2020,Illinois,US,1/30/20 16:00,1.0,0.0,0.0
410,01/30/2020,California,US,1/30/20 16:00,2.0,0.0,0.0
411,01/30/2020,Arizona,US,1/30/20 16:00,1.0,0.0,0.0
412,01/30/2020,,Japan,1/30/20 16:00,11.0,0.0,1.0
413,01/30/2020,,Thailand,1/30/20 16:00,14.0,0.0,5.0
414,01/30/2020,,South Korea,1/30/20 16:00,4.0,0.0,0.0
415,01/30/2020,,Singapore,1/30/20 16:00,10.0,0.0,0.0
416,01/30/2020,,Vietnam,1/30/20 16:00,2.0,0.0,0.0
417,01/30/2020,,France,1/30/20 16:00,5.0,0.0,0.0
418,01/30/2020,,Nepal,1/30/20 16:00,1.0,0.0,0.0
419,01/30/2020,,Malaysia,1/30/20 16:00,8.0,0.0,0.0
420,01/30/2020,Ontario,Canada,1/30/20 16:00,2.0,0.0,0.0
421,01/30/2020,British Columbia,Canada,1/30/20 16:00,1.0,0.0,0.0
422,01/30/2020,,Cambodia,1/30/20 16:00,1.0,0.0,0.0
423,01/30/2020,,Sri Lanka,1/30/20 16:00,1.0,0.0,0.0
424,01/30/2020,New South Wales,Australia,1/30/20 16:00,4.0,0.0,2.0
425,01/30/2020,Victoria,Australia,1/30/20 16:00,2.0,0.0,0.0
426,01/30/2020,Queensland,Australia,1/30/20 16:00,3.0,0.0,0.0
427,01/30/2020,Bavaria,Germany,1/30/20 16:00,4.0,0.0,0.0
428,01/30/2020,,Finland,1/30/20 16:00,1.0,0.0,0.0
429,01/30/2020,,United Arab Emirates,1/30/20 16:00,4.0,0.0,0.0
430,01/30/2020,,Philippines,1/30/20 16:00,1.0,0.0,0.0
431,01/30/2020,,India,1/30/20 16:00,1.0,0.0,0.0
432,01/31/2020,Hubei,Mainland China,1/31/2020 23:59,5806.0,204.0,141.0
433,01/31/2020,Zhejiang,Mainland China,1/31/2020 23:59,538.0,0.0,14.0
434,01/31/2020,Guangdong,Mainland China,1/31/2020 23:59,436.0,0.0,11.0
435,01/31/2020,Henan,Mainland China,1/31/2020 23:59,352.0,2.0,3.0
436,01/31/2020,Hunan,Mainland China,1/31/2020 23:59,332.0,0.0,2.0
437,01/31/2020,Jiangxi,Mainland China,1/31/2020 23:59,240.0,0.0,7.0
438,01/31/2020,Anhui,Mainland China,1/31/2020 23:59,237.0,0.0,3.0
439,01/31/2020,Chongqing,Mainland China,1/31/2020 23:59,211.0,0.0,1.0
440,01/31/2020,Shandong,Mainland China,1/31/2020 23:59,184.0,0.0,2.0
441,01/31/2020,Sichuan,Mainland China,1/31/2020 23:59,177.0,1.0,1.0
442,01/31/2020,Jiangsu,Mainland China,1/31/2020 23:59,168.0,0.0,5.0
443,01/31/2020,Beijing,Mainland China,1/31/2020 23:59,139.0,1.0,5.0
444,01/31/2020,Shanghai,Mainland China,1/31/2020 23:59,135.0,1.0,9.0
445,01/31/2020,Fujian,Mainland China,1/31/2020 23:59,120.0,0.0,0.0
446,01/31/2020,Guangxi,Mainland China,1/31/2020 23:59,87.0,0.0,2.0
447,01/31/2020,Shaanxi,Mainland China,1/31/2020 23:59,87.0,0.0,0.0
448,01/31/2020,Yunnan,Mainland China,1/31/2020 23:59,83.0,0.0,1.0
449,01/31/2020,Hebei,Mainland China,1/31/2020 23:59,82.0,1.0,0.0
450,01/31/2020,Heilongjiang,Mainland China,1/31/2020 23:59,59.0,2.0,0.0
451,01/31/2020,Hainan,Mainland China,1/31/2020 23:59,52.0,1.0,1.0
452,01/31/2020,Liaoning,Mainland China,1/31/2020 23:59,48.0,0.0,1.0
453,01/31/2020,Shanxi,Mainland China,1/31/2020 23:59,39.0,0.0,1.0
454,01/31/2020,Tianjin,Mainland China,1/31/2020 23:59,32.0,0.0,0.0
455,01/31/2020,Guizhou,Mainland China,1/31/2020 23:59,29.0,0.0,2.0
456,01/31/2020,Gansu,Mainland China,1/31/2020 23:59,29.0,0.0,0.0
457,01/31/2020,Ningxia,Mainland China,1/31/2020 23:59,21.0,0.0,0.0
458,01/31/2020,Inner Mongolia,Mainland China,1/31/2020 23:59,20.0,0.0,1.0
459,01/31/2020,Xinjiang,Mainland China,1/31/2020 23:59,17.0,0.0,0.0
460,01/31/2020,Jilin,Mainland China,1/31/2020 23:59,14.0,0.0,1.0
461,01/31/2020,Hong Kong,Hong Kong,1/31/2020 23:59,12.0,0.0,0.0
462,01/31/2020,Taiwan,Taiwan,1/31/2020 23:59,10.0,0.0,0.0
463,01/31/2020,Qinghai,Mainland China,1/31/2020 23:59,8.0,0.0,0.0
464,01/31/2020,Macau,Macau,1/31/2020 23:59,7.0,0.0,0.0
465,01/31/2020,Tibet,Mainland China,1/31/2020 23:59,1.0,0.0,0.0
466,01/31/2020,,Thailand,1/31/2020 23:59,19.0,0.0,5.0
467,01/31/2020,,Japan,1/31/2020 23:59,15.0,0.0,1.0
468,01/31/2020,,Singapore,1/31/2020 23:59,13.0,0.0,0.0
469,01/31/2020,,South Korea,1/31/2020 23:59,11.0,0.0,0.0
470,01/31/2020,,Malaysia,1/31/2020 23:59,8.0,0.0,0.0
471,01/31/2020,,France,1/31/2020 23:59,5.0,0.0,0.0
472,01/31/2020,Bavaria,Germany,1/31/2020 23:59,5.0,0.0,0.0
473,01/31/2020,New South Wales,Australia,1/31/2020 23:59,4.0,0.0,2.0
474,01/31/2020,,United Arab Emirates,1/31/2020 23:59,4.0,0.0,0.0
475,01/31/2020,Victoria,Australia,1/31/2020 23:59,3.0,0.0,0.0
476,01/31/2020,Illinois,US,1/31/2020 23:59,2.0,0.0,0.0
477,01/31/2020,California,US,1/31/2020 23:59,2.0,0.0,0.0
478,01/31/2020,,Vietnam,1/31/2020 23:59,2.0,0.0,0.0
479,01/31/2020,Ontario,Canada,1/31/2020 23:59,2.0,0.0,0.0
480,01/31/2020,Queensland,Australia,1/31/2020 23:59,2.0,0.0,0.0
481,01/31/2020,,Italy,1/31/2020 23:59,2.0,0.0,0.0
482,01/31/2020,,UK,1/31/2020 23:59,2.0,0.0,0.0
483,01/31/2020,,Russia,1/31/2020 23:59,2.0,0.0,0.0
484,01/31/2020,Washington,US,1/31/2020 23:59,1.0,0.0,0.0
485,01/31/2020,Arizona,US,1/31/2020 23:59,1.0,0.0,0.0
486,01/31/2020,,Nepal,1/31/2020 23:59,1.0,0.0,0.0
487,01/31/2020,British Columbia,Canada,1/31/2020 23:59,1.0,0.0,0.0
488,01/31/2020,,Cambodia,1/31/2020 23:59,1.0,0.0,0.0
489,01/31/2020,,Sri Lanka,1/31/2020 23:59,1.0,0.0,0.0
490,01/31/2020,,Finland,1/31/2020 23:59,1.0,0.0,0.0
491,01/31/2020,,Philippines,1/31/2020 23:59,1.0,0.0,0.0
492,01/31/2020,,India,1/31/2020 23:59,1.0,0.0,0.0
493,01/31/2020,,Sweden,1/31/2020 23:59,1.0,0.0,0.0
494,02/01/2020,Hubei,Mainland China,2/1/2020 11:53,7153.0,249.0,168.0
495,02/01/2020,Zhejiang,Mainland China,2/1/2020 10:53,599.0,0.0,21.0
496,02/01/2020,Guangdong,Mainland China,2/1/2020 14:23,535.0,0.0,14.0
497,02/01/2020,Henan,Mainland China,2/1/2020 1:52,422.0,2.0,3.0
498,02/01/2020,Hunan,Mainland China,2/1/2020 11:03,389.0,0.0,8.0
499,02/01/2020,Anhui,Mainland China,2/1/2020 13:33,297.0,0.0,5.0
500,02/01/2020,Jiangxi,Mainland China,2/1/2020 1:52,286.0,0.0,9.0
501,02/01/2020,Chongqing,Mainland China,2/1/2020 8:43,247.0,1.0,3.0
502,02/01/2020,Sichuan,Mainland China,2/1/2020 1:52,207.0,1.0,3.0
503,02/01/2020,Shandong,Mainland China,2/1/2020 7:51,206.0,0.0,3.0
504,02/01/2020,Jiangsu,Mainland China,2/1/2020 14:03,202.0,0.0,6.0
505,02/01/2020,Shanghai,Mainland China,2/1/2020 6:05,169.0,1.0,10.0
506,02/01/2020,Beijing,Mainland China,2/1/2020 9:17,168.0,1.0,9.0
507,02/01/2020,Fujian,Mainland China,2/1/2020 5:37,144.0,0.0,0.0
508,02/01/2020,Shaanxi,Mainland China,2/1/2020 5:37,101.0,0.0,0.0
509,02/01/2020,Guangxi,Mainland China,2/1/2020 1:52,100.0,0.0,2.0
510,02/01/2020,Hebei,Mainland China,2/1/2020 1:52,96.0,1.0,0.0
511,02/01/2020,Yunnan,Mainland China,2/1/2020 15:53,93.0,0.0,2.0
512,02/01/2020,Heilongjiang,Mainland China,2/1/2020 10:33,80.0,2.0,2.0
513,02/01/2020,Liaoning,Mainland China,2/1/2020 15:23,64.0,0.0,1.0
514,02/01/2020,Hainan,Mainland China,2/1/2020 8:43,62.0,1.0,1.0
515,02/01/2020,Shanxi,Mainland China,2/1/2020 1:52,47.0,0.0,1.0
516,02/01/2020,Tianjin,Mainland China,2/1/2020 15:43,41.0,0.0,0.0
517,02/01/2020,Gansu,Mainland China,2/1/2020 15:43,40.0,0.0,0.0
518,02/01/2020,Guizhou,Mainland China,1/31/2020 15:20,29.0,0.0,2.0
519,02/01/2020,Ningxia,Mainland China,2/1/2020 2:13,26.0,0.0,0.0
520,02/01/2020,Inner Mongolia,Mainland China,2/1/2020 5:37,23.0,0.0,1.0
521,02/01/2020,,Japan,2/1/2020 18:53,20.0,0.0,1.0
522,02/01/2020,,Thailand,1/31/2020 10:37,19.0,0.0,5.0
523,02/01/2020,Xinjiang,Mainland China,2/1/2020 5:37,18.0,0.0,0.0
524,02/01/2020,Jilin,Mainland China,2/1/2020 1:52,17.0,0.0,1.0
525,02/01/2020,,Singapore,2/1/2020 5:37,16.0,0.0,0.0
526,02/01/2020,Hong Kong,Hong Kong,2/1/2020 5:37,13.0,0.0,0.0
527,02/01/2020,,South Korea,2/1/2020 10:43,12.0,0.0,0.0
528,02/01/2020,Taiwan,Taiwan,1/31/2020 15:20,10.0,0.0,0.0
529,02/01/2020,Qinghai,Mainland China,2/1/2020 5:37,9.0,0.0,0.0
530,02/01/2020,,Malaysia,1/31/2020 8:15,8.0,0.0,0.0
531,02/01/2020,,Germany,2/1/2020 18:33,8.0,0.0,0.0
532,02/01/2020,Macau,Macau,1/31/2020 8:15,7.0,0.0,0.0
533,02/01/2020,,France,2/1/2020 1:52,6.0,0.0,0.0
534,02/01/2020,,Vietnam,2/1/2020 7:38,6.0,0.0,1.0
535,02/01/2020,New South Wales,Australia,2/1/2020 18:12,4.0,0.0,2.0
536,02/01/2020,Victoria,Australia,2/1/2020 18:12,4.0,0.0,0.0
537,02/01/2020,,United Arab Emirates,1/31/2020 8:15,4.0,0.0,0.0
538,02/01/2020,Queensland,Australia,2/1/2020 18:12,3.0,0.0,0.0
539,02/01/2020,Ontario,Canada,2/1/2020 18:12,3.0,0.0,0.0
540,02/01/2020,,Italy,1/31/2020 8:15,2.0,0.0,0.0
541,02/01/2020,,Russia,1/31/2020 16:13,2.0,0.0,0.0
542,02/01/2020,,UK,2/1/2020 1:52,2.0,0.0,0.0
543,02/01/2020,"Chicago, IL",US,2/1/2020 19:43,2.0,0.0,0.0
544,02/01/2020,South Australia,Australia,2/1/2020 18:12,1.0,0.0,0.0
545,02/01/2020,,Cambodia,1/31/2020 8:15,1.0,0.0,0.0
546,02/01/2020,British Columbia,Canada,2/1/2020 18:12,1.0,0.0,0.0
547,02/01/2020,,Finland,1/31/2020 8:15,1.0,0.0,0.0
548,02/01/2020,,India,1/31/2020 8:15,1.0,0.0,0.0
549,02/01/2020,Tibet,Mainland China,2/1/2020 1:52,1.0,0.0,0.0
550,02/01/2020,,Nepal,1/31/2020 8:15,1.0,0.0,0.0
551,02/01/2020,,Philippines,2/1/2020 17:43,1.0,0.0,0.0
552,02/01/2020,,Spain,2/1/2020 2:13,1.0,0.0,0.0
553,02/01/2020,,Sri Lanka,1/31/2020 8:15,1.0,0.0,0.0
554,02/01/2020,,Sweden,2/1/2020 2:13,1.0,0.0,0.0
555,02/01/2020,"Boston, MA",US,2/1/2020 19:43,1.0,0.0,0.0
556,02/01/2020,"Los Angeles, CA",US,2/1/2020 19:53,1.0,0.0,0.0
557,02/01/2020,"Orange, CA",US,2/1/2020 19:53,1.0,0.0,0.0
558,02/01/2020,"Santa Clara, CA",US,2/1/2020 19:53,1.0,0.0,0.0
559,02/01/2020,"Seattle, WA",US,2/1/2020 19:43,1.0,0.0,0.0
560,02/01/2020,"Tempe, AZ",US,2/1/2020 19:43,1.0,0.0,0.0
561,02/02/2020,Hubei,Mainland China,2020-02-02T23:43:02,11177.0,350.0,295.0
562,02/02/2020,Zhejiang,Mainland China,2020-02-02T18:03:05,661.0,0.0,32.0
563,02/02/2020,Guangdong,Mainland China,2020-02-02T18:03:05,632.0,0.0,15.0
564,02/02/2020,Henan,Mainland China,2020-02-02T18:03:05,493.0,2.0,10.0
565,02/02/2020,Hunan,Mainland China,2020-02-02T18:03:05,463.0,0.0,16.0
566,02/02/2020,Anhui,Mainland China,2020-02-02T18:03:05,340.0,0.0,7.0
567,02/02/2020,Jiangxi,Mainland China,2020-02-02T18:03:05,333.0,0.0,12.0
568,02/02/2020,Chongqing,Mainland China,2020-02-02T23:33:02,300.0,2.0,7.0
569,02/02/2020,Jiangsu,Mainland China,2020-02-02T18:03:05,236.0,0.0,7.0
570,02/02/2020,Sichuan,Mainland China,2020-02-02T18:03:05,231.0,1.0,11.0
571,02/02/2020,Shandong,Mainland China,2020-02-02T18:03:05,230.0,0.0,6.0
572,02/02/2020,Beijing,Mainland China,2020-02-02T08:43:02,191.0,1.0,9.0
573,02/02/2020,Shanghai,Mainland China,2020-02-02T05:53:02,182.0,1.0,10.0
574,02/02/2020,Fujian,Mainland China,2020-02-02T03:43:01,159.0,0.0,0.0
575,02/02/2020,Shaanxi,Mainland China,2020-02-02T03:23:14,116.0,0.0,0.0
576,02/02/2020,Guangxi,Mainland China,2020-02-02T00:23:13,111.0,0.0,2.0
577,02/02/2020,Yunnan,Mainland China,2020-02-02T18:03:05,105.0,0.0,3.0
578,02/02/2020,Hebei,Mainland China,2020-02-02T02:53:02,104.0,1.0,3.0
579,02/02/2020,Heilongjiang,Mainland China,2020-02-02T03:23:14,95.0,2.0,2.0
580,02/02/2020,Liaoning,Mainland China,2020-02-02T18:03:05,70.0,0.0,1.0
581,02/02/2020,Shanxi,Mainland China,2020-02-02T23:23:13,66.0,0.0,3.0
582,02/02/2020,Hainan,Mainland China,2020-02-02T18:03:05,64.0,1.0,4.0
583,02/02/2020,Gansu,Mainland China,2020-02-02T23:43:02,51.0,0.0,3.0
584,02/02/2020,Tianjin,Mainland China,2020-02-02T09:43:01,48.0,0.0,1.0
585,02/02/2020,Guizhou,Mainland China,2020-02-02T01:03:32,38.0,0.0,2.0
586,02/02/2020,Ningxia,Mainland China,2020-02-02T01:43:02,28.0,0.0,0.0
587,02/02/2020,Inner Mongolia,Mainland China,2020-02-02T03:43:01,27.0,0.0,1.0
588,02/02/2020,Jilin,Mainland China,2020-02-02T02:33:02,23.0,0.0,1.0
589,02/02/2020,Xinjiang,Mainland China,2020-02-02T00:43:02,21.0,0.0,0.0
590,02/02/2020,,Japan,2020-02-01T18:53:03,20.0,0.0,1.0
591,02/02/2020,,Thailand,2020-01-31T10:37:00,19.0,0.0,5.0
592,02/02/2020,,Singapore,2020-02-02T01:03:32,18.0,0.0,0.0
593,02/02/2020,Hong Kong,Hong Kong,2020-02-02T23:53:02,15.0,0.0,0.0
594,02/02/2020,,South Korea,2020-02-02T02:23:13,15.0,0.0,0.0
595,02/02/2020,Qinghai,Mainland China,2020-02-02T05:33:03,11.0,0.0,0.0
596,02/02/2020,,Germany,2020-02-02T18:03:05,10.0,0.0,0.0
597,02/02/2020,Taiwan,Taiwan,2020-01-31T15:20:56,10.0,0.0,0.0
598,02/02/2020,Macau,Macau,2020-02-02T04:23:14,8.0,0.0,0.0
599,02/02/2020,,Malaysia,2020-01-31T08:15:53,8.0,0.0,0.0
600,02/02/2020,,France,2020-02-01T01:52:40,6.0,0.0,0.0
601,02/02/2020,,Vietnam,2020-02-01T07:38:12,6.0,0.0,1.0
602,02/02/2020,,United Arab Emirates,2020-02-02T05:43:01,5.0,0.0,0.0
603,02/02/2020,New South Wales,Australia,2020-02-01T18:12:49,4.0,0.0,2.0
604,02/02/2020,Victoria,Australia,2020-02-01T18:12:49,4.0,0.0,0.0
605,02/02/2020,Ontario,Canada,2020-02-01T18:12:49,3.0,0.0,0.0
606,02/02/2020,Queensland,Australia,2020-02-02T22:33:07,2.0,0.0,0.0
607,02/02/2020,South Australia,Australia,2020-02-02T22:33:07,2.0,0.0,0.0
608,02/02/2020,,India,2020-02-02T06:03:08,2.0,0.0,0.0
609,02/02/2020,,Italy,2020-01-31T08:15:53,2.0,0.0,0.0
610,02/02/2020,,Philippines,2020-02-02T03:33:07,2.0,1.0,0.0
611,02/02/2020,,Russia,2020-01-31T16:13:45,2.0,0.0,0.0
612,02/02/2020,,UK,2020-02-01T01:52:40,2.0,0.0,0.0
613,02/02/2020,"Chicago, IL",US,2020-02-01T19:43:03,2.0,0.0,0.0
614,02/02/2020,,Cambodia,2020-01-31T08:15:53,1.0,0.0,0.0
615,02/02/2020,British Columbia,Canada,2020-02-01T18:12:49,1.0,0.0,0.0
616,02/02/2020,,Finland,2020-01-31T08:15:53,1.0,0.0,0.0
617,02/02/2020,Tibet,Mainland China,2020-02-01T01:52:40,1.0,0.0,0.0
618,02/02/2020,,Nepal,2020-01-31T08:15:53,1.0,0.0,0.0
619,02/02/2020,,Spain,2020-02-01T23:43:02,1.0,0.0,0.0
620,02/02/2020,,Sri Lanka,2020-01-31T08:15:53,1.0,0.0,0.0
621,02/02/2020,,Sweden,2020-02-01T02:13:26,1.0,0.0,0.0
622,02/02/2020,"Boston, MA",US,2020-02-01T19:43:03,1.0,0.0,0.0
623,02/02/2020,"Los Angeles, CA",US,2020-02-01T19:53:03,1.0,0.0,0.0
624,02/02/2020,"Orange, CA",US,2020-02-01T19:53:03,1.0,0.0,0.0
625,02/02/2020,"Santa Clara, CA",US,2020-02-01T19:53:03,1.0,0.0,0.0
626,02/02/2020,"Seattle, WA",US,2020-02-01T19:43:03,1.0,0.0,0.0
627,02/02/2020,"Tempe, AZ",US,2020-02-01T19:43:03,1.0,0.0,0.0
628,02/03/2020,Hubei,Mainland China,2020-02-03T23:23:03,13522.0,414.0,386.0
629,02/03/2020,Guangdong,Mainland China,2020-02-03T12:53:02,725.0,0.0,21.0
630,02/03/2020,Zhejiang,Mainland China,2020-02-03T13:33:02,724.0,0.0,43.0
631,02/03/2020,Henan,Mainland China,2020-02-03T17:11:34,566.0,2.0,16.0
632,02/03/2020,Hunan,Mainland China,2020-02-03T11:03:10,521.0,0.0,22.0
633,02/03/2020,Anhui,Mainland China,2020-02-03T17:11:34,408.0,0.0,14.0
634,02/03/2020,Jiangxi,Mainland China,2020-02-03T01:33:02,391.0,0.0,18.0
635,02/03/2020,Chongqing,Mainland China,2020-02-03T23:43:02,337.0,2.0,9.0
636,02/03/2020,Jiangsu,Mainland China,2020-02-03T11:03:10,271.0,0.0,8.0
637,02/03/2020,Shandong,Mainland China,2020-02-03T17:11:34,259.0,0.0,7.0
638,02/03/2020,Sichuan,Mainland China,2020-02-03T11:23:23,254.0,1.0,14.0
639,02/03/2020,Beijing,Mainland China,2020-02-03T09:23:05,212.0,1.0,12.0
640,02/03/2020,Shanghai,Mainland China,2020-02-03T07:03:12,203.0,1.0,10.0
641,02/03/2020,Fujian,Mainland China,2020-02-03T11:33:13,179.0,0.0,1.0
642,02/03/2020,Shaanxi,Mainland China,2020-02-03T02:33:02,128.0,0.0,0.0
643,02/03/2020,Guangxi,Mainland China,2020-02-03T12:33:02,127.0,0.0,7.0
644,02/03/2020,Heilongjiang,Mainland China,2020-02-03T07:13:19,121.0,2.0,2.0
645,02/03/2020,Yunnan,Mainland China,2020-02-03T23:23:03,117.0,0.0,5.0
646,02/03/2020,Hebei,Mainland China,2020-02-03T00:23:14,113.0,1.0,3.0
647,02/03/2020,Liaoning,Mainland China,2020-02-03T17:11:34,74.0,0.0,1.0
648,02/03/2020,Shanxi,Mainland China,2020-02-03T23:13:11,74.0,0.0,2.0
649,02/03/2020,Hainan,Mainland China,2020-02-03T17:11:34,72.0,1.0,4.0
650,02/03/2020,Tianjin,Mainland China,2020-02-03T13:53:03,60.0,0.0,1.0
651,02/03/2020,Gansu,Mainland China,2020-02-03T23:03:08,55.0,0.0,3.0
652,02/03/2020,Guizhou,Mainland China,2020-02-03T01:03:22,46.0,0.0,2.0
653,02/03/2020,Inner Mongolia,Mainland China,2020-02-03T03:03:09,34.0,0.0,1.0
654,02/03/2020,Jilin,Mainland China,2020-02-03T00:53:03,31.0,0.0,1.0
655,02/03/2020,Ningxia,Mainland China,2020-02-03T08:33:03,31.0,0.0,1.0
656,02/03/2020,Xinjiang,Mainland China,2020-02-03T01:13:21,24.0,0.0,0.0
657,02/03/2020,,Japan,2020-02-01T18:53:03,20.0,0.0,1.0
658,02/03/2020,,Thailand,2020-01-31T10:37:00,19.0,0.0,5.0
659,02/03/2020,,Singapore,2020-02-02T01:03:32,18.0,0.0,0.0
660,02/03/2020,Hong Kong,Hong Kong,2020-02-02T23:53:02,15.0,0.0,0.0
661,02/03/2020,,South Korea,2020-02-02T02:23:13,15.0,0.0,0.0
662,02/03/2020,Qinghai,Mainland China,2020-02-03T02:43:01,13.0,0.0,0.0
663,02/03/2020,,Germany,2020-02-03T20:53:02,12.0,0.0,0.0
664,02/03/2020,Taiwan,Taiwan,2020-01-31T15:20:56,10.0,0.0,0.0
665,02/03/2020,Macau,Macau,2020-02-02T04:23:14,8.0,0.0,0.0
666,02/03/2020,,Malaysia,2020-01-31T08:15:53,8.0,0.0,0.0
667,02/03/2020,,Vietnam,2020-02-03T21:43:02,8.0,0.0,1.0
668,02/03/2020,,France,2020-02-01T01:52:40,6.0,0.0,0.0
669,02/03/2020,,United Arab Emirates,2020-02-02T05:43:01,5.0,0.0,0.0
670,02/03/2020,New South Wales,Australia,2020-02-01T18:12:49,4.0,0.0,2.0
671,02/03/2020,Victoria,Australia,2020-02-01T18:12:49,4.0,0.0,0.0
672,02/03/2020,Ontario,Canada,2020-02-01T18:12:49,3.0,0.0,0.0
673,02/03/2020,,India,2020-02-03T21:43:02,3.0,0.0,0.0
674,02/03/2020,Queensland,Australia,2020-02-02T22:33:07,2.0,0.0,0.0
675,02/03/2020,South Australia,Australia,2020-02-02T22:33:07,2.0,0.0,0.0
676,02/03/2020,,Italy,2020-01-31T08:15:53,2.0,0.0,0.0
677,02/03/2020,,Philippines,2020-02-02T03:33:07,2.0,1.0,0.0
678,02/03/2020,,Russia,2020-01-31T16:13:45,2.0,0.0,0.0
679,02/03/2020,,UK,2020-02-01T01:52:40,2.0,0.0,0.0
680,02/03/2020,"Chicago, IL",US,2020-02-01T19:43:03,2.0,0.0,0.0
681,02/03/2020,"San Benito, CA",US,2020-02-03T03:53:02,2.0,0.0,0.0
682,02/03/2020,"Santa Clara, CA",US,2020-02-03T00:43:02,2.0,0.0,0.0
683,02/03/2020,,Cambodia,2020-01-31T08:15:53,1.0,0.0,0.0
684,02/03/2020,British Columbia,Canada,2020-02-01T18:12:49,1.0,0.0,0.0
685,02/03/2020,,Finland,2020-01-31T08:15:53,1.0,0.0,0.0
686,02/03/2020,Tibet,Mainland China,2020-02-01T01:52:40,1.0,0.0,0.0
687,02/03/2020,,Nepal,2020-01-31T08:15:53,1.0,0.0,0.0
688,02/03/2020,,Spain,2020-02-01T23:43:02,1.0,0.0,0.0
689,02/03/2020,,Sri Lanka,2020-01-31T08:15:53,1.0,0.0,0.0
690,02/03/2020,,Sweden,2020-02-01T02:13:26,1.0,0.0,0.0
691,02/03/2020,"Boston, MA",US,2020-02-01T19:43:03,1.0,0.0,0.0
692,02/03/2020,"Los Angeles, CA",US,2020-02-01T19:53:03,1.0,0.0,0.0
693,02/03/2020,"Orange, CA",US,2020-02-01T19:53:03,1.0,0.0,0.0
694,02/03/2020,"Seattle, WA",US,2020-02-01T19:43:03,1.0,0.0,0.0
695,02/03/2020,"Tempe, AZ",US,2020-02-01T19:43:03,1.0,0.0,0.0
696,02/04/2020,Hubei,Mainland China,2020-02-04T23:43:01,16678.0,479.0,522.0
697,02/04/2020,Zhejiang,Mainland China,2020-02-04T13:03:07,829.0,0.0,62.0
698,02/04/2020,Guangdong,Mainland China,2020-02-04T13:03:07,813.0,0.0,30.0
699,02/04/2020,Henan,Mainland China,2020-02-04T11:53:02,675.0,2.0,27.0
700,02/04/2020,Hunan,Mainland China,2020-02-04T14:03:03,593.0,0.0,31.0
701,02/04/2020,Anhui,Mainland China,2020-02-04T05:33:01,480.0,0.0,20.0
702,02/04/2020,Jiangxi,Mainland China,2020-02-04T14:43:02,476.0,0.0,20.0
703,02/04/2020,Chongqing,Mainland China,2020-02-04T23:43:01,366.0,2.0,9.0
704,02/04/2020,Jiangsu,Mainland China,2020-02-04T11:53:02,308.0,0.0,12.0
705,02/04/2020,Sichuan,Mainland China,2020-02-04T01:43:02,282.0,1.0,14.0
706,02/04/2020,Shandong,Mainland China,2020-02-04T12:03:04,275.0,0.0,11.0
707,02/04/2020,Beijing,Mainland China,2020-02-04T08:33:01,228.0,1.0,23.0
708,02/04/2020,Shanghai,Mainland China,2020-02-04T06:33:02,219.0,1.0,12.0
709,02/04/2020,Fujian,Mainland China,2020-02-04T12:13:11,194.0,0.0,3.0
710,02/04/2020,Heilongjiang,Mainland China,2020-02-04T07:43:01,155.0,2.0,4.0
711,02/04/2020,Shaanxi,Mainland China,2020-02-04T12:33:02,142.0,0.0,2.0
712,02/04/2020,Guangxi,Mainland China,2020-02-04T05:53:01,139.0,0.0,10.0
713,02/04/2020,Hebei,Mainland China,2020-02-04T08:53:01,126.0,1.0,4.0
714,02/04/2020,Yunnan,Mainland China,2020-02-04T23:23:02,122.0,0.0,5.0
715,02/04/2020,Liaoning,Mainland China,2020-02-04T14:13:08,81.0,0.0,2.0
716,02/04/2020,Shanxi,Mainland China,2020-02-04T23:23:02,81.0,0.0,4.0
717,02/04/2020,Hainan,Mainland China,2020-02-04T11:33:03,80.0,1.0,5.0
718,02/04/2020,Tianjin,Mainland China,2020-02-04T13:33:02,67.0,0.0,2.0
719,02/04/2020,Guizhou,Mainland China,2020-02-04T10:43:02,58.0,0.0,2.0
720,02/04/2020,Gansu,Mainland China,2020-02-04T15:43:02,57.0,0.0,4.0
721,02/04/2020,Jilin,Mainland China,2020-02-04T00:23:05,42.0,0.0,1.0
722,02/04/2020,Inner Mongolia,Mainland China,2020-02-04T03:03:07,35.0,0.0,1.0
723,02/04/2020,Ningxia,Mainland China,2020-02-04T02:13:18,34.0,0.0,1.0
724,02/04/2020,Xinjiang,Mainland China,2020-02-04T01:33:01,29.0,0.0,0.0
725,02/04/2020,,Thailand,2020-02-04T15:33:03,25.0,0.0,5.0
726,02/04/2020,,Singapore,2020-02-04T15:33:03,24.0,0.0,0.0
727,02/04/2020,,Japan,2020-02-04T16:43:03,22.0,0.0,1.0
728,02/04/2020,Hong Kong,Hong Kong,2020-02-04T09:03:02,17.0,1.0,0.0
729,02/04/2020,,South Korea,2020-02-04T15:33:03,16.0,0.0,0.0
730,02/04/2020,Qinghai,Mainland China,2020-02-04T01:33:01,15.0,0.0,0.0
731,02/04/2020,,Germany,2020-02-03T20:53:02,12.0,0.0,0.0
732,02/04/2020,Taiwan,Taiwan,2020-02-04T14:53:02,11.0,0.0,0.0
733,02/04/2020,Macau,Macau,2020-02-04T04:43:02,10.0,0.0,0.0
734,02/04/2020,,Malaysia,2020-02-04T07:33:02,10.0,0.0,0.0
735,02/04/2020,,Vietnam,2020-02-03T21:43:02,8.0,0.0,1.0
736,02/04/2020,,France,2020-02-01T01:52:40,6.0,0.0,0.0
737,02/04/2020,,United Arab Emirates,2020-02-02T05:43:01,5.0,0.0,0.0
738,02/04/2020,New South Wales,Australia,2020-02-01T18:12:49,4.0,0.0,2.0
739,02/04/2020,Victoria,Australia,2020-02-01T18:12:49,4.0,0.0,0.0
740,02/04/2020,Queensland,Australia,2020-02-04T16:53:03,3.0,0.0,0.0
741,02/04/2020,,India,2020-02-03T21:43:02,3.0,0.0,0.0
742,02/04/2020,South Australia,Australia,2020-02-02T22:33:07,2.0,0.0,0.0
743,02/04/2020,"Toronto, ON",Canada,2020-02-04T00:13:06,2.0,0.0,0.0
744,02/04/2020,,Italy,2020-01-31T08:15:53,2.0,0.0,0.0
745,02/04/2020,,Philippines,2020-02-02T03:33:07,2.0,1.0,0.0
746,02/04/2020,,Russia,2020-01-31T16:13:45,2.0,0.0,0.0
747,02/04/2020,,UK,2020-02-01T01:52:40,2.0,0.0,0.0
748,02/04/2020,"Chicago, IL",US,2020-02-01T19:43:03,2.0,0.0,0.0
749,02/04/2020,"San Benito, CA",US,2020-02-03T03:53:02,2.0,0.0,0.0
750,02/04/2020,"Santa Clara, CA",US,2020-02-03T00:43:02,2.0,0.0,0.0
751,02/04/2020,,Belgium,2020-02-04T15:43:02,1.0,0.0,0.0
752,02/04/2020,,Cambodia,2020-01-31T08:15:53,1.0,0.0,0.0
753,02/04/2020,British Columbia,Canada,2020-02-01T18:12:49,1.0,0.0,0.0
754,02/04/2020,"London, ON",Canada,2020-02-04T00:03:11,1.0,0.0,0.0
755,02/04/2020,,Finland,2020-01-31T08:15:53,1.0,0.0,0.0
756,02/04/2020,Tibet,Mainland China,2020-02-01T01:52:40,1.0,0.0,0.0
757,02/04/2020,,Nepal,2020-01-31T08:15:53,1.0,0.0,0.0
758,02/04/2020,,Spain,2020-02-01T23:43:02,1.0,0.0,0.0
759,02/04/2020,,Sri Lanka,2020-01-31T08:15:53,1.0,0.0,0.0
760,02/04/2020,,Sweden,2020-02-01T02:13:26,1.0,0.0,0.0
761,02/04/2020,"Boston, MA",US,2020-02-01T19:43:03,1.0,0.0,0.0
762,02/04/2020,"Los Angeles, CA",US,2020-02-01T19:53:03,1.0,0.0,0.0
763,02/04/2020,"Orange, CA",US,2020-02-01T19:53:03,1.0,0.0,0.0
764,02/04/2020,"Seattle, WA",US,2020-02-01T19:43:03,1.0,0.0,0.0
765,02/04/2020,"Tempe, AZ",US,2020-02-01T19:43:03,1.0,0.0,0.0
766,02/05/2020,Hubei,Mainland China,2020-02-05T23:13:12,19665.0,549.0,633.0
767,02/05/2020,Guangdong,Mainland China,2020-02-05T13:23:04,895.0,0.0,49.0
768,02/05/2020,Zhejiang,Mainland China,2020-02-05T15:13:02,895.0,0.0,78.0
769,02/05/2020,Henan,Mainland China,2020-02-05T15:03:02,764.0,2.0,47.0
770,02/05/2020,Hunan,Mainland China,2020-02-05T15:23:02,661.0,0.0,54.0
771,02/05/2020,Jiangxi,Mainland China,2020-02-05T01:33:07,548.0,0.0,27.0
772,02/05/2020,Anhui,Mainland China,2020-02-05T13:43:02,530.0,0.0,23.0
773,02/05/2020,Chongqing,Mainland China,2020-02-05T23:43:02,389.0,2.0,15.0
774,02/05/2020,Jiangsu,Mainland China,2020-02-05T12:43:02,341.0,0.0,23.0
775,02/05/2020,Shandong,Mainland China,2020-02-05T10:13:13,307.0,0.0,15.0
776,02/05/2020,Sichuan,Mainland China,2020-02-05T10:13:13,301.0,1.0,24.0
777,02/05/2020,Beijing,Mainland China,2020-02-05T05:43:02,253.0,1.0,24.0
778,02/05/2020,Shanghai,Mainland China,2020-02-05T06:23:04,243.0,1.0,15.0
779,02/05/2020,Fujian,Mainland China,2020-02-05T12:33:01,205.0,0.0,11.0
780,02/05/2020,Heilongjiang,Mainland China,2020-02-05T12:13:04,190.0,2.0,7.0
781,02/05/2020,Shaanxi,Mainland China,2020-02-05T08:43:01,165.0,0.0,6.0
782,02/05/2020,Guangxi,Mainland China,2020-02-05T12:03:08,150.0,0.0,13.0
783,02/05/2020,Hebei,Mainland China,2020-02-05T11:23:18,135.0,1.0,6.0
784,02/05/2020,Yunnan,Mainland China,2020-02-05T23:33:02,128.0,0.0,5.0
785,02/05/2020,Hainan,Mainland China,2020-02-05T16:43:04,99.0,1.0,5.0
786,02/05/2020,Liaoning,Mainland China,2020-02-05T15:23:02,89.0,0.0,4.0
787,02/05/2020,Shanxi,Mainland China,2020-02-05T15:23:02,81.0,0.0,5.0
788,02/05/2020,Tianjin,Mainland China,2020-02-05T03:43:02,69.0,1.0,2.0
789,02/05/2020,Guizhou,Mainland China,2020-02-05T12:33:02,64.0,1.0,9.0
790,02/05/2020,Gansu,Mainland China,2020-02-05T16:23:06,62.0,0.0,6.0
791,02/05/2020,Jilin,Mainland China,2020-02-05T11:03:16,54.0,0.0,2.0
792,02/05/2020,Inner Mongolia,Mainland China,2020-02-05T08:53:02,42.0,0.0,3.0
793,02/05/2020,Ningxia,Mainland China,2020-02-04T02:13:18,34.0,0.0,1.0
794,02/05/2020,Xinjiang,Mainland China,2020-02-05T02:03:13,32.0,0.0,0.0
795,02/05/2020,,Singapore,2020-02-05T16:33:03,28.0,0.0,0.0
796,02/05/2020,,Thailand,2020-02-04T15:33:03,25.0,0.0,5.0
797,02/05/2020,,Japan,2020-02-04T16:43:03,22.0,0.0,1.0
798,02/05/2020,Hong Kong,Hong Kong,2020-02-05T13:13:10,21.0,1.0,0.0
799,02/05/2020,,South Korea,2020-02-05T15:33:01,19.0,0.0,0.0
800,02/05/2020,Qinghai,Mainland China,2020-02-05T03:13:05,17.0,0.0,3.0
801,02/05/2020,,Germany,2020-02-03T20:53:02,12.0,0.0,0.0
802,02/05/2020,,Malaysia,2020-02-05T15:43:02,12.0,0.0,0.0
803,02/05/2020,Taiwan,Taiwan,2020-02-04T14:53:02,11.0,0.0,0.0
804,02/05/2020,Macau,Macau,2020-02-04T04:43:02,10.0,0.0,0.0
805,02/05/2020,,Vietnam,2020-02-03T21:43:02,8.0,0.0,1.0
806,02/05/2020,,France,2020-02-01T01:52:40,6.0,0.0,0.0
807,02/05/2020,,United Arab Emirates,2020-02-02T05:43:01,5.0,0.0,0.0
808,02/05/2020,New South Wales,Australia,2020-02-01T18:12:49,4.0,0.0,2.0
809,02/05/2020,Victoria,Australia,2020-02-01T18:12:49,4.0,0.0,0.0
810,02/05/2020,Queensland,Australia,2020-02-04T16:53:03,3.0,0.0,0.0
811,02/05/2020,,India,2020-02-03T21:43:02,3.0,0.0,0.0
812,02/05/2020,South Australia,Australia,2020-02-02T22:33:07,2.0,0.0,0.0
813,02/05/2020,British Columbia,Canada,2020-02-05T17:33:03,2.0,0.0,0.0
814,02/05/2020,"Toronto, ON",Canada,2020-02-04T00:13:06,2.0,0.0,0.0
815,02/05/2020,,Italy,2020-01-31T08:15:53,2.0,0.0,0.0
816,02/05/2020,,Philippines,2020-02-02T03:33:07,2.0,1.0,0.0
817,02/05/2020,,Russia,2020-01-31T16:13:45,2.0,0.0,0.0
818,02/05/2020,,UK,2020-02-01T01:52:40,2.0,0.0,0.0
819,02/05/2020,"Chicago, IL",US,2020-02-01T19:43:03,2.0,0.0,0.0
820,02/05/2020,"San Benito, CA",US,2020-02-03T03:53:02,2.0,0.0,0.0
821,02/05/2020,"Santa Clara, CA",US,2020-02-03T00:43:02,2.0,0.0,0.0
822,02/05/2020,,Belgium,2020-02-04T15:43:02,1.0,0.0,0.0
823,02/05/2020,,Cambodia,2020-01-31T08:15:53,1.0,0.0,0.0
824,02/05/2020,"London, ON",Canada,2020-02-04T00:03:11,1.0,0.0,0.0
825,02/05/2020,,Finland,2020-01-31T08:15:53,1.0,0.0,0.0
826,02/05/2020,Tibet,Mainland China,2020-02-01T01:52:40,1.0,0.0,0.0
827,02/05/2020,,Nepal,2020-01-31T08:15:53,1.0,0.0,0.0
828,02/05/2020,,Spain,2020-02-01T23:43:02,1.0,0.0,0.0
829,02/05/2020,,Sri Lanka,2020-01-31T08:15:53,1.0,0.0,0.0
830,02/05/2020,,Sweden,2020-02-01T02:13:26,1.0,0.0,0.0
831,02/05/2020,"Boston, MA",US,2020-02-01T19:43:03,1.0,0.0,0.0
832,02/05/2020,"Los Angeles, CA",US,2020-02-01T19:53:03,1.0,0.0,0.0
833,02/05/2020,"Madison, WI",US,2020-02-05T21:53:02,1.0,0.0,0.0
834,02/05/2020,"Orange, CA",US,2020-02-01T19:53:03,1.0,0.0,0.0
835,02/05/2020,"Seattle, WA",US,2020-02-01T19:43:03,1.0,0.0,0.0
836,02/05/2020,"Tempe, AZ",US,2020-02-01T19:43:03,1.0,0.0,0.0
837,02/06/2020,Hubei,Mainland China,2020-02-06T23:23:02,22112.0,618.0,817.0
838,02/06/2020,Guangdong,Mainland China,2020-02-06T12:43:02,970.0,0.0,69.0
839,02/06/2020,Zhejiang,Mainland China,2020-02-06T10:53:04,954.0,0.0,94.0
840,02/06/2020,Henan,Mainland China,2020-02-06T11:23:14,851.0,2.0,56.0
841,02/06/2020,Hunan,Mainland China,2020-02-06T13:13:06,711.0,0.0,81.0
842,02/06/2020,Jiangxi,Mainland China,2020-02-06T02:33:01,600.0,0.0,37.0
843,02/06/2020,Anhui,Mainland China,2020-02-06T13:33:02,591.0,0.0,34.0
844,02/06/2020,Chongqing,Mainland China,2020-02-06T23:33:02,411.0,2.0,24.0
845,02/06/2020,Jiangsu,Mainland China,2020-02-06T08:03:10,373.0,0.0,34.0
846,02/06/2020,Shandong,Mainland China,2020-02-06T07:53:02,347.0,0.0,27.0
847,02/06/2020,Sichuan,Mainland China,2020-02-06T08:03:10,321.0,1.0,31.0
848,02/06/2020,Beijing,Mainland China,2020-02-06T03:23:11,274.0,1.0,31.0
849,02/06/2020,Shanghai,Mainland China,2020-02-06T06:53:07,257.0,1.0,25.0
850,02/06/2020,Heilongjiang,Mainland China,2020-02-06T08:13:06,227.0,3.0,8.0
851,02/06/2020,Fujian,Mainland China,2020-02-06T11:03:19,215.0,0.0,14.0
852,02/06/2020,Shaanxi,Mainland China,2020-02-06T13:53:02,173.0,0.0,9.0
853,02/06/2020,Guangxi,Mainland China,2020-02-06T04:13:13,168.0,0.0,14.0
854,02/06/2020,Hebei,Mainland China,2020-02-06T13:53:02,157.0,1.0,13.0
855,02/06/2020,Yunnan,Mainland China,2020-02-06T09:43:02,133.0,0.0,7.0
856,02/06/2020,Hainan,Mainland China,2020-02-06T11:13:24,106.0,1.0,8.0
857,02/06/2020,Shanxi,Mainland China,2020-02-06T23:03:02,96.0,0.0,12.0
858,02/06/2020,Liaoning,Mainland China,2020-02-06T14:33:02,94.0,0.0,5.0
859,02/06/2020,Tianjin,Mainland China,2020-02-06T23:43:01,79.0,1.0,2.0
860,02/06/2020,Guizhou,Mainland China,2020-02-06T09:53:02,71.0,1.0,6.0
861,02/06/2020,Gansu,Mainland China,2020-02-05T16:23:06,62.0,0.0,6.0
862,02/06/2020,Jilin,Mainland China,2020-02-06T14:23:04,59.0,0.0,4.0
863,02/06/2020,Inner Mongolia,Mainland China,2020-02-06T02:23:08,46.0,0.0,4.0
864,02/06/2020,,Japan,2020-02-06T02:53:03,45.0,0.0,1.0
865,02/06/2020,Ningxia,Mainland China,2020-02-06T02:13:15,40.0,0.0,1.0
866,02/06/2020,Xinjiang,Mainland China,2020-02-06T01:13:08,36.0,0.0,0.0
867,02/06/2020,,Singapore,2020-02-05T16:33:03,28.0,0.0,0.0
868,02/06/2020,,Thailand,2020-02-04T15:33:03,25.0,0.0,5.0
869,02/06/2020,Hong Kong,Hong Kong,2020-02-06T14:43:02,24.0,1.0,0.0
870,02/06/2020,,South Korea,2020-02-06T02:53:03,23.0,0.0,0.0
871,02/06/2020,Qinghai,Mainland China,2020-02-06T02:13:15,18.0,0.0,3.0
872,02/06/2020,Taiwan,Taiwan,2020-02-06T15:03:04,16.0,0.0,1.0
873,02/06/2020,,Germany,2020-02-03T20:53:02,12.0,0.0,0.0
874,02/06/2020,,Malaysia,2020-02-05T15:43:02,12.0,0.0,0.0
875,02/06/2020,Macau,Macau,2020-02-06T14:23:04,10.0,0.0,1.0
876,02/06/2020,,Vietnam,2020-02-06T01:13:08,10.0,0.0,1.0
877,02/06/2020,,France,2020-02-01T01:52:40,6.0,0.0,0.0
878,02/06/2020,,United Arab Emirates,2020-02-02T05:43:01,5.0,0.0,0.0
879,02/06/2020,New South Wales,Australia,2020-02-06T03:13:22,4.0,0.0,2.0
880,02/06/2020,Queensland,Australia,2020-02-06T02:53:03,4.0,0.0,0.0
881,02/06/2020,Victoria,Australia,2020-02-01T18:12:49,4.0,0.0,0.0
882,02/06/2020,,India,2020-02-03T21:43:02,3.0,0.0,0.0
883,02/06/2020,South Australia,Australia,2020-02-02T22:33:07,2.0,0.0,0.0
884,02/06/2020,British Columbia,Canada,2020-02-05T17:33:03,2.0,0.0,0.0
885,02/06/2020,"Toronto, ON",Canada,2020-02-04T00:13:06,2.0,0.0,0.0
886,02/06/2020,,Italy,2020-01-31T08:15:53,2.0,0.0,0.0
887,02/06/2020,,Philippines,2020-02-02T03:33:07,2.0,1.0,0.0
888,02/06/2020,,Russia,2020-01-31T16:13:45,2.0,0.0,0.0
889,02/06/2020,,UK,2020-02-01T01:52:40,2.0,0.0,0.0
890,02/06/2020,"Chicago, IL",US,2020-02-01T19:43:03,2.0,0.0,0.0
891,02/06/2020,"San Benito, CA",US,2020-02-03T03:53:02,2.0,0.0,0.0
892,02/06/2020,"Santa Clara, CA",US,2020-02-03T00:43:02,2.0,0.0,0.0
893,02/06/2020,,Belgium,2020-02-04T15:43:02,1.0,0.0,0.0
894,02/06/2020,,Cambodia,2020-01-31T08:15:53,1.0,0.0,0.0
895,02/06/2020,"London, ON",Canada,2020-02-04T00:03:11,1.0,0.0,0.0
896,02/06/2020,,Finland,2020-01-31T08:15:53,1.0,0.0,0.0
897,02/06/2020,Tibet,Mainland China,2020-02-01T01:52:40,1.0,0.0,0.0
898,02/06/2020,,Nepal,2020-01-31T08:15:53,1.0,0.0,0.0
899,02/06/2020,,Spain,2020-02-01T23:43:02,1.0,0.0,0.0
900,02/06/2020,,Sri Lanka,2020-01-31T08:15:53,1.0,0.0,0.0
901,02/06/2020,,Sweden,2020-02-01T02:13:26,1.0,0.0,0.0
902,02/06/2020,"Boston, MA",US,2020-02-01T19:43:03,1.0,0.0,0.0
903,02/06/2020,"Los Angeles, CA",US,2020-02-01T19:53:03,1.0,0.0,0.0
904,02/06/2020,"Madison, WI",US,2020-02-05T21:53:02,1.0,0.0,0.0
905,02/06/2020,"Orange, CA",US,2020-02-01T19:53:03,1.0,0.0,0.0
906,02/06/2020,"Seattle, WA",US,2020-02-01T19:43:03,1.0,0.0,0.0
907,02/06/2020,"Tempe, AZ",US,2020-02-01T19:43:03,1.0,0.0,0.0
908,02/07/2020,Hubei,Mainland China,2020-02-07T23:43:02,24953.0,699.0,1115.0
909,02/07/2020,Guangdong,Mainland China,2020-02-07T10:13:06,1034.0,1.0,88.0
910,02/07/2020,Zhejiang,Mainland China,2020-02-07T11:33:11,1006.0,0.0,123.0
911,02/07/2020,Henan,Mainland China,2020-02-07T14:03:12,914.0,3.0,86.0
912,02/07/2020,Hunan,Mainland China,2020-02-07T11:33:11,772.0,0.0,112.0
913,02/07/2020,Anhui,Mainland China,2020-02-07T05:13:07,665.0,0.0,47.0
914,02/07/2020,Jiangxi,Mainland China,2020-02-07T01:23:02,661.0,0.0,45.0
915,02/07/2020,Chongqing,Mainland China,2020-02-07T23:33:02,426.0,2.0,31.0
916,02/07/2020,Jiangsu,Mainland China,2020-02-07T14:03:12,408.0,0.0,43.0
917,02/07/2020,Shandong,Mainland China,2020-02-07T11:33:11,386.0,0.0,37.0
918,02/07/2020,Sichuan,Mainland China,2020-02-07T08:23:09,344.0,1.0,42.0
919,02/07/2020,Beijing,Mainland China,2020-02-07T03:23:02,297.0,1.0,33.0
920,02/07/2020,Heilongjiang,Mainland China,2020-02-07T07:43:02,277.0,3.0,12.0
921,02/07/2020,Shanghai,Mainland China,2020-02-07T06:14:15,277.0,1.0,30.0
922,02/07/2020,Fujian,Mainland China,2020-02-07T13:23:03,224.0,0.0,20.0
923,02/07/2020,Shaanxi,Mainland China,2020-02-07T08:23:09,184.0,0.0,17.0
924,02/07/2020,Guangxi,Mainland China,2020-02-07T00:33:02,172.0,0.0,17.0
925,02/07/2020,Hebei,Mainland China,2020-02-07T12:03:04,172.0,1.0,22.0
926,02/07/2020,Yunnan,Mainland China,2020-02-07T23:23:04,138.0,0.0,12.0
927,02/07/2020,Hainan,Mainland China,2020-02-07T12:33:02,117.0,2.0,10.0
928,02/07/2020,Shanxi,Mainland China,2020-02-07T23:43:02,104.0,0.0,15.0
929,02/07/2020,Liaoning,Mainland China,2020-02-07T15:33:03,99.0,0.0,7.0
930,02/07/2020,Guizhou,Mainland China,2020-02-07T11:13:07,81.0,1.0,6.0
931,02/07/2020,Tianjin,Mainland China,2020-02-07T05:43:03,81.0,1.0,2.0
932,02/07/2020,Gansu,Mainland China,2020-02-07T02:33:06,67.0,0.0,9.0
933,02/07/2020,Jilin,Mainland China,2020-02-07T00:43:02,65.0,1.0,4.0
934,02/07/2020,Cruise Ship,Others,2020-02-07T16:33:03,61.0,0.0,0.0
935,02/07/2020,Inner Mongolia,Mainland China,2020-02-07T11:13:07,50.0,0.0,5.0
936,02/07/2020,Ningxia,Mainland China,2020-02-07T11:13:07,43.0,0.0,5.0
937,02/07/2020,Xinjiang,Mainland China,2020-02-07T01:43:02,39.0,0.0,0.0
938,02/07/2020,,Singapore,2020-02-07T03:03:03,30.0,0.0,0.0
939,02/07/2020,Hong Kong,Hong Kong,2020-02-07T11:53:02,25.0,1.0,0.0
940,02/07/2020,,Japan,2020-02-07T04:13:20,25.0,0.0,1.0
941,02/07/2020,,Thailand,2020-02-04T15:33:03,25.0,0.0,5.0
942,02/07/2020,,South Korea,2020-02-07T03:03:03,24.0,0.0,1.0
943,02/07/2020,Qinghai,Mainland China,2020-02-06T02:13:15,18.0,0.0,3.0
944,02/07/2020,Taiwan,Taiwan,2020-02-06T15:03:04,16.0,0.0,1.0
945,02/07/2020,,Germany,2020-02-07T16:33:03,13.0,0.0,0.0
946,02/07/2020,,Malaysia,2020-02-07T09:13:21,12.0,0.0,1.0
947,02/07/2020,Macau,Macau,2020-02-06T14:23:04,10.0,0.0,1.0
948,02/07/2020,,Vietnam,2020-02-06T01:13:08,10.0,0.0,1.0
949,02/07/2020,,France,2020-02-01T01:52:40,6.0,0.0,0.0
950,02/07/2020,Queensland,Australia,2020-02-07T01:03:02,5.0,0.0,0.0
951,02/07/2020,,United Arab Emirates,2020-02-02T05:43:01,5.0,0.0,0.0
952,02/07/2020,New South Wales,Australia,2020-02-06T03:13:22,4.0,0.0,2.0
953,02/07/2020,Victoria,Australia,2020-02-01T18:12:49,4.0,0.0,0.0
954,02/07/2020,British Columbia,Canada,2020-02-07T05:43:03,4.0,0.0,0.0
955,02/07/2020,,India,2020-02-03T21:43:02,3.0,0.0,0.0
956,02/07/2020,,Italy,2020-02-07T17:53:02,3.0,0.0,0.0
957,02/07/2020,,Philippines,2020-02-07T16:43:04,3.0,1.0,0.0
958,02/07/2020,,UK,2020-02-07T18:33:02,3.0,0.0,0.0
959,02/07/2020,South Australia,Australia,2020-02-02T22:33:07,2.0,0.0,0.0
960,02/07/2020,"Toronto, ON",Canada,2020-02-04T00:13:06,2.0,0.0,0.0
961,02/07/2020,,Russia,2020-01-31T16:13:45,2.0,0.0,0.0
962,02/07/2020,"Chicago, IL",US,2020-02-01T19:43:03,2.0,0.0,0.0
963,02/07/2020,"San Benito, CA",US,2020-02-03T03:53:02,2.0,0.0,0.0
964,02/07/2020,"Santa Clara, CA",US,2020-02-03T00:43:02,2.0,0.0,0.0
965,02/07/2020,,Belgium,2020-02-04T15:43:02,1.0,0.0,0.0
966,02/07/2020,,Cambodia,2020-01-31T08:15:53,1.0,0.0,0.0
967,02/07/2020,"London, ON",Canada,2020-02-04T00:03:11,1.0,0.0,0.0
968,02/07/2020,,Finland,2020-01-31T08:15:53,1.0,0.0,0.0
969,02/07/2020,Tibet,Mainland China,2020-02-01T01:52:40,1.0,0.0,0.0
970,02/07/2020,,Nepal,2020-01-31T08:15:53,1.0,0.0,0.0
971,02/07/2020,,Spain,2020-02-01T23:43:02,1.0,0.0,0.0
972,02/07/2020,,Sri Lanka,2020-01-31T08:15:53,1.0,0.0,0.0
973,02/07/2020,,Sweden,2020-02-01T02:13:26,1.0,0.0,0.0
974,02/07/2020,"Boston, MA",US,2020-02-01T19:43:03,1.0,0.0,0.0
975,02/07/2020,"Los Angeles, CA",US,2020-02-01T19:53:03,1.0,0.0,0.0
976,02/07/2020,"Madison, WI",US,2020-02-05T21:53:02,1.0,0.0,0.0
977,02/07/2020,"Orange, CA",US,2020-02-01T19:53:03,1.0,0.0,0.0
978,02/07/2020,"Seattle, WA",US,2020-02-01T19:43:03,1.0,0.0,0.0
979,02/07/2020,"Tempe, AZ",US,2020-02-01T19:43:03,1.0,0.0,0.0
980,02/08/2020,Hubei,Mainland China,2020-02-08T23:33:06,27100.0,780.0,1439.0
981,02/08/2020,Guangdong,Mainland China,2020-02-08T11:53:01,1095.0,1.0,112.0
982,02/08/2020,Zhejiang,Mainland China,2020-02-08T10:53:02,1048.0,0.0,175.0
983,02/08/2020,Henan,Mainland China,2020-02-08T14:13:12,981.0,4.0,116.0
984,02/08/2020,Hunan,Mainland China,2020-02-08T12:53:01,803.0,1.0,156.0
985,02/08/2020,Anhui,Mainland China,2020-02-08T07:43:02,733.0,0.0,59.0
986,02/08/2020,Jiangxi,Mainland China,2020-02-08T01:23:02,698.0,0.0,55.0
987,02/08/2020,Jiangsu,Mainland China,2020-02-08T10:23:04,439.0,0.0,51.0
988,02/08/2020,Chongqing,Mainland China,2020-02-08T11:03:15,428.0,2.0,39.0
989,02/08/2020,Shandong,Mainland China,2020-02-08T11:33:02,416.0,0.0,44.0
990,02/08/2020,Sichuan,Mainland China,2020-02-08T15:23:04,364.0,1.0,60.0
991,02/08/2020,Beijing,Mainland China,2020-02-08T03:13:09,315.0,2.0,34.0
992,02/08/2020,Heilongjiang,Mainland China,2020-02-08T04:03:09,295.0,5.0,13.0
993,02/08/2020,Shanghai,Mainland China,2020-02-08T06:33:02,286.0,1.0,41.0
994,02/08/2020,Fujian,Mainland China,2020-02-08T08:13:10,239.0,0.0,24.0
995,02/08/2020,Hebei,Mainland China,2020-02-08T11:33:02,195.0,1.0,30.0
996,02/08/2020,Shaanxi,Mainland China,2020-02-08T10:13:06,195.0,0.0,20.0
997,02/08/2020,Guangxi,Mainland China,2020-02-08T00:23:03,183.0,0.0,17.0
998,02/08/2020,Yunnan,Mainland China,2020-02-08T08:43:02,138.0,0.0,17.0
999,02/08/2020,Hainan,Mainland China,2020-02-08T10:23:04,124.0,2.0,14.0
1000,02/08/2020,Shanxi,Mainland China,2020-02-08T23:53:02,115.0,0.0,21.0
1001,02/08/2020,Liaoning,Mainland China,2020-02-08T11:53:01,105.0,0.0,8.0
1002,02/08/2020,Guizhou,Mainland China,2020-02-08T06:43:03,89.0,1.0,7.0
1003,02/08/2020,Tianjin,Mainland China,2020-02-08T08:23:04,88.0,1.0,4.0
1004,02/08/2020,Gansu,Mainland China,2020-02-08T15:13:14,79.0,1.0,12.0
1005,02/08/2020,Jilin,Mainland China,2020-02-08T00:13:04,69.0,1.0,4.0
1006,02/08/2020,Cruise Ship,Others,2020-02-07T16:33:03,61.0,0.0,0.0
1007,02/08/2020,Inner Mongolia,Mainland China,2020-02-08T03:33:02,52.0,0.0,5.0
1008,02/08/2020,Ningxia,Mainland China,2020-02-08T09:13:16,45.0,0.0,15.0
1009,02/08/2020,Xinjiang,Mainland China,2020-02-08T03:23:10,42.0,0.0,0.0
1010,02/08/2020,,Singapore,2020-02-08T12:53:01,33.0,0.0,2.0
1011,02/08/2020,,Thailand,2020-02-08T12:53:01,32.0,0.0,10.0
1012,02/08/2020,Hong Kong,Hong Kong,2020-02-08T00:03:07,26.0,1.0,0.0
1013,02/08/2020,,Japan,2020-02-07T04:13:20,25.0,0.0,1.0
1014,02/08/2020,,South Korea,2020-02-07T03:03:03,24.0,0.0,1.0
1015,02/08/2020,Qinghai,Mainland China,2020-02-06T02:13:15,18.0,0.0,3.0
1016,02/08/2020,Taiwan,Taiwan,2020-02-08T05:23:02,17.0,0.0,1.0
1017,02/08/2020,,Malaysia,2020-02-08T10:23:04,16.0,0.0,1.0
1018,02/08/2020,,Germany,2020-02-07T16:33:03,13.0,0.0,0.0
1019,02/08/2020,,Vietnam,2020-02-08T07:23:04,13.0,0.0,1.0
1020,02/08/2020,,France,2020-02-08T09:53:01,11.0,0.0,0.0
1021,02/08/2020,Macau,Macau,2020-02-06T14:23:04,10.0,0.0,1.0
1022,02/08/2020,,United Arab Emirates,2020-02-08T07:03:16,7.0,0.0,0.0
1023,02/08/2020,Queensland,Australia,2020-02-07T01:03:02,5.0,0.0,0.0
1024,02/08/2020,New South Wales,Australia,2020-02-06T03:13:22,4.0,0.0,2.0
1025,02/08/2020,Victoria,Australia,2020-02-01T18:12:49,4.0,0.0,0.0
1026,02/08/2020,British Columbia,Canada,2020-02-07T05:43:03,4.0,0.0,0.0
1027,02/08/2020,,India,2020-02-03T21:43:02,3.0,0.0,0.0
1028,02/08/2020,,Italy,2020-02-07T17:53:02,3.0,0.0,0.0
1029,02/08/2020,,Philippines,2020-02-07T16:43:04,3.0,1.0,0.0
1030,02/08/2020,,UK,2020-02-07T18:33:02,3.0,0.0,0.0
1031,02/08/2020,South Australia,Australia,2020-02-02T22:33:07,2.0,0.0,0.0
1032,02/08/2020,"Toronto, ON",Canada,2020-02-04T00:13:06,2.0,0.0,0.0
1033,02/08/2020,,Russia,2020-01-31T16:13:45,2.0,0.0,0.0
1034,02/08/2020,"Chicago, IL",US,2020-02-01T19:43:03,2.0,0.0,0.0
1035,02/08/2020,"San Benito, CA",US,2020-02-03T03:53:02,2.0,0.0,0.0
1036,02/08/2020,"Santa Clara, CA",US,2020-02-03T00:43:02,2.0,0.0,0.0
1037,02/08/2020,,Belgium,2020-02-04T15:43:02,1.0,0.0,0.0
1038,02/08/2020,,Cambodia,2020-01-31T08:15:53,1.0,0.0,0.0
1039,02/08/2020,"London, ON",Canada,2020-02-04T00:03:11,1.0,0.0,0.0
1040,02/08/2020,,Finland,2020-01-31T08:15:53,1.0,0.0,0.0
1041,02/08/2020,Tibet,Mainland China,2020-02-01T01:52:40,1.0,0.0,0.0
1042,02/08/2020,,Nepal,2020-01-31T08:15:53,1.0,0.0,0.0
1043,02/08/2020,,Spain,2020-02-01T23:43:02,1.0,0.0,0.0
1044,02/08/2020,,Sri Lanka,2020-02-08T03:43:03,1.0,0.0,1.0
1045,02/08/2020,,Sweden,2020-02-01T02:13:26,1.0,0.0,0.0
1046,02/08/2020,"Boston, MA",US,2020-02-01T19:43:03,1.0,0.0,0.0
1047,02/08/2020,"Los Angeles, CA",US,2020-02-01T19:53:03,1.0,0.0,0.0
1048,02/08/2020,"Madison, WI",US,2020-02-05T21:53:02,1.0,0.0,0.0
1049,02/08/2020,"Orange, CA",US,2020-02-01T19:53:03,1.0,0.0,0.0
1050,02/08/2020,"Seattle, WA",US,2020-02-01T19:43:03,1.0,0.0,0.0
1051,02/08/2020,"Tempe, AZ",US,2020-02-01T19:43:03,1.0,0.0,0.0
1052,02/09/2020,Hubei,Mainland China,2020-02-09T23:33:02,29631.0,871.0,1795.0
1053,02/09/2020,Guangdong,Mainland China,2020-02-09T15:03:05,1131.0,1.0,141.0
1054,02/09/2020,Zhejiang,Mainland China,2020-02-09T12:03:04,1075.0,0.0,201.0
1055,02/09/2020,Henan,Mainland China,2020-02-09T11:23:08,1033.0,6.0,153.0
1056,02/09/2020,Hunan,Mainland China,2020-02-09T12:33:01,838.0,1.0,186.0
1057,02/09/2020,Anhui,Mainland China,2020-02-09T09:33:02,779.0,1.0,72.0
1058,02/09/2020,Jiangxi,Mainland China,2020-02-09T11:33:12,740.0,0.0,73.0
1059,02/09/2020,Chongqing,Mainland China,2020-02-09T23:53:02,468.0,2.0,51.0
1060,02/09/2020,Jiangsu,Mainland China,2020-02-09T10:23:11,468.0,0.0,71.0
1061,02/09/2020,Shandong,Mainland China,2020-02-09T15:03:05,444.0,1.0,63.0
1062,02/09/2020,Sichuan,Mainland China,2020-02-09T12:43:01,386.0,1.0,71.0
1063,02/09/2020,Beijing,Mainland China,2020-02-09T03:43:02,326.0,2.0,37.0
1064,02/09/2020,Heilongjiang,Mainland China,2020-02-09T08:43:05,307.0,6.0,14.0
1065,02/09/2020,Shanghai,Mainland China,2020-02-09T06:33:01,293.0,1.0,44.0
1066,02/09/2020,Fujian,Mainland China,2020-02-09T09:13:11,250.0,0.0,35.0
1067,02/09/2020,Shaanxi,Mainland China,2020-02-09T03:03:09,208.0,0.0,25.0
1068,02/09/2020,Hebei,Mainland China,2020-02-09T12:43:01,206.0,2.0,34.0
1069,02/09/2020,Guangxi,Mainland China,2020-02-09T00:33:07,195.0,1.0,18.0
1070,02/09/2020,Yunnan,Mainland China,2020-02-09T08:53:02,141.0,0.0,18.0
1071,02/09/2020,Hainan,Mainland China,2020-02-09T13:33:02,131.0,3.0,19.0
1072,02/09/2020,Shanxi,Mainland China,2020-02-09T23:43:02,119.0,0.0,25.0
1073,02/09/2020,Liaoning,Mainland China,2020-02-09T12:23:03,107.0,0.0,12.0
1074,02/09/2020,Guizhou,Mainland China,2020-02-09T09:53:02,99.0,1.0,7.0
1075,02/09/2020,Tianjin,Mainland China,2020-02-09T23:43:02,91.0,1.0,4.0
1076,02/09/2020,Gansu,Mainland China,2020-02-09T23:33:02,83.0,2.0,16.0
1077,02/09/2020,Jilin,Mainland China,2020-02-09T09:03:04,78.0,1.0,12.0
1078,02/09/2020,Diamond Princess cruise ship,Others,2020-02-09T06:13:11,64.0,0.0,0.0
1079,02/09/2020,Inner Mongolia,Mainland China,2020-02-09T02:23:07,54.0,0.0,5.0
1080,02/09/2020,Ningxia,Mainland China,2020-02-09T02:03:11,45.0,0.0,13.0
1081,02/09/2020,Xinjiang,Mainland China,2020-02-09T01:23:08,45.0,0.0,0.0
1082,02/09/2020,,Singapore,2020-02-09T02:43:02,40.0,0.0,2.0
1083,02/09/2020,,Thailand,2020-02-08T12:53:01,32.0,0.0,10.0
1084,02/09/2020,Hong Kong,Hong Kong,2020-02-09T09:53:02,29.0,1.0,0.0
1085,02/09/2020,,Japan,2020-02-09T06:13:11,26.0,0.0,1.0
1086,02/09/2020,,South Korea,2020-02-09T02:33:02,25.0,0.0,3.0
1087,02/09/2020,Qinghai,Mainland China,2020-02-06T02:13:15,18.0,0.0,3.0
1088,02/09/2020,Taiwan,Taiwan,2020-02-09T09:13:11,18.0,0.0,1.0
1089,02/09/2020,,Malaysia,2020-02-08T10:23:04,16.0,0.0,1.0
1090,02/09/2020,,Germany,2020-02-09T06:13:11,14.0,0.0,0.0
1091,02/09/2020,,Vietnam,2020-02-08T07:23:04,13.0,0.0,1.0
1092,02/09/2020,,France,2020-02-08T09:53:01,11.0,0.0,0.0
1093,02/09/2020,Macau,Macau,2020-02-06T14:23:04,10.0,0.0,1.0
1094,02/09/2020,,United Arab Emirates,2020-02-08T07:03:16,7.0,0.0,0.0
1095,02/09/2020,Queensland,Australia,2020-02-09T19:33:02,5.0,0.0,0.0
1096,02/09/2020,New South Wales,Australia,2020-02-06T03:13:22,4.0,0.0,2.0
1097,02/09/2020,Victoria,Australia,2020-02-01T18:12:49,4.0,0.0,0.0
1098,02/09/2020,British Columbia,Canada,2020-02-07T05:43:03,4.0,0.0,0.0
1099,02/09/2020,,India,2020-02-03T21:43:02,3.0,0.0,0.0
1100,02/09/2020,,Italy,2020-02-07T17:53:02,3.0,0.0,0.0
1101,02/09/2020,,Philippines,2020-02-07T16:43:04,3.0,1.0,0.0
1102,02/09/2020,,UK,2020-02-07T18:33:02,3.0,0.0,0.0
1103,02/09/2020,South Australia,Australia,2020-02-02T22:33:07,2.0,0.0,0.0
1104,02/09/2020,"Toronto, ON",Canada,2020-02-04T00:13:06,2.0,0.0,0.0
1105,02/09/2020,,Russia,2020-01-31T16:13:45,2.0,0.0,0.0
1106,02/09/2020,,Spain,2020-02-09T20:33:03,2.0,0.0,0.0
1107,02/09/2020,"Chicago, IL",US,2020-02-09T19:03:03,2.0,0.0,2.0
1108,02/09/2020,"San Benito, CA",US,2020-02-03T03:53:02,2.0,0.0,0.0
1109,02/09/2020,"Santa Clara, CA",US,2020-02-03T00:43:02,2.0,0.0,0.0
1110,02/09/2020,,Belgium,2020-02-04T15:43:02,1.0,0.0,0.0
1111,02/09/2020,,Cambodia,2020-01-31T08:15:53,1.0,0.0,0.0
1112,02/09/2020,"London, ON",Canada,2020-02-04T00:03:11,1.0,0.0,0.0
1113,02/09/2020,,Finland,2020-01-31T08:15:53,1.0,0.0,0.0
1114,02/09/2020,Tibet,Mainland China,2020-02-01T01:52:40,1.0,0.0,0.0
1115,02/09/2020,,Nepal,2020-01-31T08:15:53,1.0,0.0,0.0
1116,02/09/2020,,Sri Lanka,2020-02-08T03:43:03,1.0,0.0,1.0
1117,02/09/2020,,Sweden,2020-02-01T02:13:26,1.0,0.0,0.0
1118,02/09/2020,"Boston, MA",US,2020-02-01T19:43:03,1.0,0.0,0.0
1119,02/09/2020,"Los Angeles, CA",US,2020-02-01T19:53:03,1.0,0.0,0.0
1120,02/09/2020,"Madison, WI",US,2020-02-05T21:53:02,1.0,0.0,0.0
1121,02/09/2020,"Orange, CA",US,2020-02-01T19:53:03,1.0,0.0,0.0
1122,02/09/2020,"Seattle, WA",US,2020-02-09T07:03:04,1.0,0.0,1.0
1123,02/09/2020,"Tempe, AZ",US,2020-02-01T19:43:03,1.0,0.0,0.0
1124,02/10/2020,Hubei,Mainland China,2020-02-10T23:33:02,31728.0,974.0,2222.0
1125,02/10/2020,Guangdong,Mainland China,2020-02-10T13:43:02,1159.0,1.0,167.0
1126,02/10/2020,Zhejiang,Mainland China,2020-02-10T14:13:12,1092.0,0.0,242.0
1127,02/10/2020,Henan,Mainland China,2020-02-10T13:53:02,1073.0,6.0,191.0
1128,02/10/2020,Hunan,Mainland China,2020-02-10T13:53:02,879.0,1.0,208.0
1129,02/10/2020,Anhui,Mainland China,2020-02-10T07:23:04,830.0,3.0,88.0
1130,02/10/2020,Jiangxi,Mainland China,2020-02-10T13:53:02,771.0,1.0,105.0
1131,02/10/2020,Jiangsu,Mainland China,2020-02-10T14:03:05,492.0,0.0,81.0
1132,02/10/2020,Chongqing,Mainland China,2020-02-10T23:43:02,486.0,2.0,66.0
1133,02/10/2020,Shandong,Mainland China,2020-02-10T09:33:02,466.0,1.0,66.0
1134,02/10/2020,Sichuan,Mainland China,2020-02-10T10:03:02,405.0,1.0,80.0
1135,02/10/2020,Beijing,Mainland China,2020-02-10T03:13:08,337.0,2.0,44.0
1136,02/10/2020,Heilongjiang,Mainland China,2020-02-10T07:33:05,331.0,7.0,30.0
1137,02/10/2020,Shanghai,Mainland China,2020-02-10T06:03:13,299.0,1.0,48.0
1138,02/10/2020,Fujian,Mainland China,2020-02-10T14:03:05,261.0,0.0,39.0
1139,02/10/2020,Hebei,Mainland China,2020-02-10T10:03:02,218.0,2.0,41.0
1140,02/10/2020,Shaanxi,Mainland China,2020-02-10T13:23:06,213.0,0.0,30.0
1141,02/10/2020,Guangxi,Mainland China,2020-02-10T14:03:05,210.0,1.0,24.0
1142,02/10/2020,Yunnan,Mainland China,2020-02-10T09:43:02,149.0,0.0,19.0
1143,02/10/2020,Hainan,Mainland China,2020-02-10T09:33:02,138.0,3.0,19.0
1144,02/10/2020,Diamond Princess cruise ship,Others,2020-02-10T16:03:12,135.0,0.0,0.0
1145,02/10/2020,Shanxi,Mainland China,2020-02-09T23:43:02,119.0,0.0,25.0
1146,02/10/2020,Guizhou,Mainland China,2020-02-10T12:33:02,109.0,1.0,10.0
1147,02/10/2020,Liaoning,Mainland China,2020-02-10T14:03:05,108.0,0.0,13.0
1148,02/10/2020,Tianjin,Mainland China,2020-02-10T14:23:08,95.0,1.0,8.0
1149,02/10/2020,Gansu,Mainland China,2020-02-10T07:23:04,83.0,2.0,17.0
1150,02/10/2020,Jilin,Mainland China,2020-02-10T14:03:05,80.0,1.0,13.0
1151,02/10/2020,Inner Mongolia,Mainland China,2020-02-10T02:43:05,58.0,0.0,5.0
1152,02/10/2020,Ningxia,Mainland China,2020-02-10T01:43:02,49.0,0.0,13.0
1153,02/10/2020,Xinjiang,Mainland China,2020-02-10T01:13:06,49.0,0.0,0.0
1154,02/10/2020,,Singapore,2020-02-10T19:03:02,45.0,0.0,2.0
1155,02/10/2020,Hong Kong,Hong Kong,2020-02-10T10:13:06,38.0,1.0,0.0
1156,02/10/2020,,Thailand,2020-02-08T12:53:01,32.0,0.0,10.0
1157,02/10/2020,,South Korea,2020-02-10T03:03:09,27.0,0.0,3.0
1158,02/10/2020,,Japan,2020-02-10T21:33:02,26.0,0.0,4.0
1159,02/10/2020,Qinghai,Mainland China,2020-02-06T02:13:15,18.0,0.0,3.0
1160,02/10/2020,,Malaysia,2020-02-10T03:03:09,18.0,0.0,1.0
1161,02/10/2020,Taiwan,Taiwan,2020-02-09T09:13:11,18.0,0.0,1.0
1162,02/10/2020,,Germany,2020-02-09T06:13:11,14.0,0.0,0.0
1163,02/10/2020,,Vietnam,2020-02-10T03:03:09,14.0,0.0,1.0
1164,02/10/2020,,France,2020-02-08T09:53:01,11.0,0.0,0.0
1165,02/10/2020,Macau,Macau,2020-02-06T14:23:04,10.0,0.0,1.0
1166,02/10/2020,,UK,2020-02-10T19:03:02,8.0,0.0,0.0
1167,02/10/2020,,United Arab Emirates,2020-02-10T23:03:09,8.0,0.0,0.0
1168,02/10/2020,Queensland,Australia,2020-02-09T19:33:02,5.0,0.0,0.0
1169,02/10/2020,New South Wales,Australia,2020-02-06T03:13:22,4.0,0.0,2.0
1170,02/10/2020,Victoria,Australia,2020-02-01T18:12:49,4.0,0.0,0.0
1171,02/10/2020,British Columbia,Canada,2020-02-07T05:43:03,4.0,0.0,0.0
1172,02/10/2020,,India,2020-02-03T21:43:02,3.0,0.0,0.0
1173,02/10/2020,,Italy,2020-02-07T17:53:02,3.0,0.0,0.0
1174,02/10/2020,,Philippines,2020-02-07T16:43:04,3.0,1.0,0.0
1175,02/10/2020,South Australia,Australia,2020-02-02T22:33:07,2.0,0.0,0.0
1176,02/10/2020,"Toronto, ON",Canada,2020-02-04T00:13:06,2.0,0.0,0.0
1177,02/10/2020,,Russia,2020-01-31T16:13:45,2.0,0.0,0.0
1178,02/10/2020,,Spain,2020-02-09T20:33:03,2.0,0.0,0.0
1179,02/10/2020,"Chicago, IL",US,2020-02-09T19:03:03,2.0,0.0,2.0
1180,02/10/2020,"San Benito, CA",US,2020-02-03T03:53:02,2.0,0.0,0.0
1181,02/10/2020,"Santa Clara, CA",US,2020-02-03T00:43:02,2.0,0.0,0.0
1182,02/10/2020,,Belgium,2020-02-04T15:43:02,1.0,0.0,0.0
1183,02/10/2020,,Cambodia,2020-01-31T08:15:53,1.0,0.0,0.0
1184,02/10/2020,"London, ON",Canada,2020-02-04T00:03:11,1.0,0.0,0.0
1185,02/10/2020,,Finland,2020-01-31T08:15:53,1.0,0.0,0.0
1186,02/10/2020,Tibet,Mainland China,2020-02-01T01:52:40,1.0,0.0,0.0
1187,02/10/2020,,Nepal,2020-01-31T08:15:53,1.0,0.0,0.0
1188,02/10/2020,,Sri Lanka,2020-02-08T03:43:03,1.0,0.0,1.0
1189,02/10/2020,,Sweden,2020-02-01T02:13:26,1.0,0.0,0.0
1190,02/10/2020,"Boston, MA",US,2020-02-01T19:43:03,1.0,0.0,0.0
1191,02/10/2020,"Los Angeles, CA",US,2020-02-01T19:53:03,1.0,0.0,0.0
1192,02/10/2020,"Madison, WI",US,2020-02-05T21:53:02,1.0,0.0,0.0
1193,02/10/2020,"Orange, CA",US,2020-02-01T19:53:03,1.0,0.0,0.0
1194,02/10/2020,"Seattle, WA",US,2020-02-09T07:03:04,1.0,0.0,1.0
1195,02/10/2020,"Tempe, AZ",US,2020-02-01T19:43:03,1.0,0.0,0.0
1196,02/11/2020,Hubei,Mainland China,2020-02-11T23:33:02,33366.0,1068.0,2639.0
1197,02/11/2020,Guangdong,Mainland China,2020-02-11T14:03:05,1177.0,1.0,212.0
1198,02/11/2020,Zhejiang,Mainland China,2020-02-11T12:53:02,1117.0,0.0,270.0
1199,02/11/2020,Henan,Mainland China,2020-02-11T14:03:05,1105.0,7.0,218.0
1200,02/11/2020,Hunan,Mainland China,2020-02-11T12:53:02,912.0,1.0,247.0
1201,02/11/2020,Anhui,Mainland China,2020-02-11T09:43:02,860.0,4.0,105.0
1202,02/11/2020,Jiangxi,Mainland China,2020-02-11T14:03:05,804.0,1.0,128.0
1203,02/11/2020,Jiangsu,Mainland China,2020-02-11T08:13:06,515.0,0.0,93.0
1204,02/11/2020,Chongqing,Mainland China,2020-02-11T23:53:02,505.0,3.0,79.0
1205,02/11/2020,Shandong,Mainland China,2020-02-11T11:23:04,487.0,1.0,80.0
1206,02/11/2020,Sichuan,Mainland China,2020-02-11T11:23:04,417.0,1.0,85.0
1207,02/11/2020,Heilongjiang,Mainland China,2020-02-11T11:23:04,360.0,8.0,28.0
1208,02/11/2020,Beijing,Mainland China,2020-02-11T03:03:07,342.0,3.0,48.0
1209,02/11/2020,Shanghai,Mainland China,2020-02-11T06:23:02,303.0,1.0,52.0
1210,02/11/2020,Fujian,Mainland China,2020-02-11T14:03:05,267.0,0.0,45.0
1211,02/11/2020,Hebei,Mainland China,2020-02-11T11:23:04,239.0,2.0,48.0
1212,02/11/2020,Shaanxi,Mainland China,2020-02-11T06:03:16,219.0,0.0,32.0
1213,02/11/2020,Guangxi,Mainland China,2020-02-11T11:23:04,215.0,1.0,33.0
1214,02/11/2020,Yunnan,Mainland China,2020-02-11T09:23:04,153.0,0.0,20.0
1215,02/11/2020,Hainan,Mainland China,2020-02-11T14:33:02,144.0,3.0,20.0
1216,02/11/2020,Diamond Princess cruise ship,Others,2020-02-10T16:03:12,135.0,0.0,0.0
1217,02/11/2020,Guizhou,Mainland China,2020-02-11T14:03:05,127.0,1.0,17.0
1218,02/11/2020,Shanxi,Mainland China,2020-02-11T23:33:02,124.0,0.0,30.0
1219,02/11/2020,Liaoning,Mainland China,2020-02-11T12:53:02,111.0,0.0,19.0
1220,02/11/2020,Tianjin,Mainland China,2020-02-11T23:13:05,106.0,2.0,10.0
1221,02/11/2020,Gansu,Mainland China,2020-02-11T15:23:04,86.0,2.0,24.0
1222,02/11/2020,Jilin,Mainland China,2020-02-11T08:03:06,81.0,1.0,18.0
1223,02/11/2020,Inner Mongolia,Mainland China,2020-02-10T02:43:05,58.0,0.0,5.0
1224,02/11/2020,Xinjiang,Mainland China,2020-02-11T09:13:11,55.0,0.0,3.0
1225,02/11/2020,Ningxia,Mainland China,2020-02-11T10:03:08,53.0,0.0,22.0
1226,02/11/2020,Hong Kong,Hong Kong,2020-02-11T09:43:02,49.0,1.0,0.0
1227,02/11/2020,,Singapore,2020-02-11T16:43:06,47.0,0.0,9.0
1228,02/11/2020,,Thailand,2020-02-11T18:43:04,33.0,0.0,10.0
1229,02/11/2020,,South Korea,2020-02-11T02:53:02,28.0,0.0,3.0
1230,02/11/2020,,Japan,2020-02-11T02:53:02,26.0,0.0,9.0
1231,02/11/2020,Qinghai,Mainland China,2020-02-11T11:23:04,18.0,0.0,5.0
1232,02/11/2020,,Malaysia,2020-02-11T03:13:13,18.0,0.0,3.0
1233,02/11/2020,Taiwan,Taiwan,2020-02-09T09:13:11,18.0,0.0,1.0
1234,02/11/2020,,Germany,2020-02-11T19:33:03,16.0,0.0,0.0
1235,02/11/2020,,Vietnam,2020-02-11T16:43:06,15.0,0.0,6.0
1236,02/11/2020,,France,2020-02-08T09:53:01,11.0,0.0,0.0
1237,02/11/2020,Macau,Macau,2020-02-06T14:23:04,10.0,0.0,1.0
1238,02/11/2020,,UK,2020-02-10T19:03:02,8.0,0.0,0.0
1239,02/11/2020,,United Arab Emirates,2020-02-10T23:03:09,8.0,0.0,0.0
1240,02/11/2020,Queensland,Australia,2020-02-09T19:33:02,5.0,0.0,0.0
1241,02/11/2020,New South Wales,Australia,2020-02-06T03:13:22,4.0,0.0,2.0
1242,02/11/2020,Victoria,Australia,2020-02-01T18:12:49,4.0,0.0,0.0
1243,02/11/2020,British Columbia,Canada,2020-02-07T05:43:03,4.0,0.0,0.0
1244,02/11/2020,,India,2020-02-03T21:43:02,3.0,0.0,0.0
1245,02/11/2020,,Italy,2020-02-07T17:53:02,3.0,0.0,0.0
1246,02/11/2020,,Philippines,2020-02-07T16:43:04,3.0,1.0,0.0
1247,02/11/2020,South Australia,Australia,2020-02-02T22:33:07,2.0,0.0,0.0
1248,02/11/2020,"Toronto, ON",Canada,2020-02-04T00:13:06,2.0,0.0,0.0
1249,02/11/2020,,Russia,2020-01-31T16:13:45,2.0,0.0,0.0
1250,02/11/2020,,Spain,2020-02-09T20:33:03,2.0,0.0,0.0
1251,02/11/2020,"Chicago, IL",US,2020-02-09T19:03:03,2.0,0.0,2.0
1252,02/11/2020,"San Benito, CA",US,2020-02-03T03:53:02,2.0,0.0,0.0
1253,02/11/2020,"Santa Clara, CA",US,2020-02-03T00:43:02,2.0,0.0,0.0
1254,02/11/2020,,Belgium,2020-02-04T15:43:02,1.0,0.0,0.0
1255,02/11/2020,,Cambodia,2020-01-31T08:15:53,1.0,0.0,0.0
1256,02/11/2020,"London, ON",Canada,2020-02-04T00:03:11,1.0,0.0,0.0
1257,02/11/2020,,Finland,2020-01-31T08:15:53,1.0,0.0,0.0
1258,02/11/2020,Tibet,Mainland China,2020-02-01T01:52:40,1.0,0.0,0.0
1259,02/11/2020,,Nepal,2020-01-31T08:15:53,1.0,0.0,0.0
1260,02/11/2020,,Sri Lanka,2020-02-08T03:43:03,1.0,0.0,1.0
1261,02/11/2020,,Sweden,2020-02-01T02:13:26,1.0,0.0,0.0
1262,02/11/2020,"Boston, MA",US,2020-02-01T19:43:03,1.0,0.0,0.0
1263,02/11/2020,"Los Angeles, CA",US,2020-02-01T19:53:03,1.0,0.0,0.0
1264,02/11/2020,"Madison, WI",US,2020-02-05T21:53:02,1.0,0.0,0.0
1265,02/11/2020,"Orange, CA",US,2020-02-01T19:53:03,1.0,0.0,0.0
1266,02/11/2020,"San Diego County, CA",US,2020-02-11T01:23:05,1.0,0.0,0.0
1267,02/11/2020,"Seattle, WA",US,2020-02-09T07:03:04,1.0,0.0,1.0
1268,02/11/2020,"Tempe, AZ",US,2020-02-01T19:43:03,1.0,0.0,0.0
1269,02/12/2020,Hubei,Mainland China,2020-02-12T14:13:08,33366.0,1068.0,2686.0
1270,02/12/2020,Guangdong,Mainland China,2020-02-12T12:23:09,1219.0,1.0,275.0
1271,02/12/2020,Henan,Mainland China,2020-02-12T14:13:08,1135.0,8.0,246.0
1272,02/12/2020,Zhejiang,Mainland China,2020-02-12T10:13:20,1131.0,0.0,321.0
1273,02/12/2020,Hunan,Mainland China,2020-02-12T12:43:03,946.0,2.0,304.0
1274,02/12/2020,Anhui,Mainland China,2020-02-12T10:13:20,889.0,4.0,127.0
1275,02/12/2020,Jiangxi,Mainland China,2020-02-12T01:23:06,844.0,1.0,152.0
1276,02/12/2020,Jiangsu,Mainland China,2020-02-12T14:13:08,543.0,0.0,125.0
1277,02/12/2020,Chongqing,Mainland China,2020-02-12T23:13:08,518.0,3.0,102.0
1278,02/12/2020,Shandong,Mainland China,2020-02-12T11:13:05,497.0,2.0,92.0
1279,02/12/2020,Sichuan,Mainland China,2020-02-12T12:43:03,436.0,1.0,92.0
1280,02/12/2020,Heilongjiang,Mainland China,2020-02-12T14:13:08,378.0,8.0,31.0
1281,02/12/2020,Beijing,Mainland China,2020-02-12T02:43:03,352.0,3.0,56.0
1282,02/12/2020,Shanghai,Mainland China,2020-02-12T06:23:08,311.0,1.0,57.0
1283,02/12/2020,Fujian,Mainland China,2020-02-12T11:53:02,272.0,0.0,53.0
1284,02/12/2020,Hebei,Mainland China,2020-02-12T11:13:05,251.0,2.0,54.0
1285,02/12/2020,Shaanxi,Mainland China,2020-02-12T11:13:05,225.0,0.0,43.0
1286,02/12/2020,Guangxi,Mainland China,2020-02-12T15:03:05,222.0,1.0,32.0
1287,02/12/2020,Diamond Princess cruise ship,Others,2020-02-12T04:23:38,175.0,0.0,0.0
1288,02/12/2020,Hainan,Mainland China,2020-02-12T17:03:03,157.0,4.0,27.0
1289,02/12/2020,Yunnan,Mainland China,2020-02-12T14:13:08,154.0,0.0,26.0
1290,02/12/2020,Guizhou,Mainland China,2020-02-12T09:43:02,133.0,1.0,18.0
1291,02/12/2020,Shanxi,Mainland China,2020-02-12T23:03:02,126.0,0.0,33.0
1292,02/12/2020,Liaoning,Mainland China,2020-02-12T13:33:02,116.0,1.0,20.0
1293,02/12/2020,Tianjin,Mainland China,2020-02-12T15:03:05,112.0,2.0,11.0
1294,02/12/2020,Gansu,Mainland China,2020-02-12T23:23:01,87.0,2.0,31.0
1295,02/12/2020,Jilin,Mainland China,2020-02-12T14:13:08,83.0,1.0,22.0
1296,02/12/2020,Inner Mongolia,Mainland China,2020-02-12T11:13:05,60.0,0.0,6.0
1297,02/12/2020,Xinjiang,Mainland China,2020-02-12T01:43:02,59.0,0.0,3.0
1298,02/12/2020,Ningxia,Mainland China,2020-02-12T11:13:05,58.0,0.0,24.0
1299,02/12/2020,Hong Kong,Hong Kong,2020-02-12T09:53:02,50.0,1.0,1.0
1300,02/12/2020,,Singapore,2020-02-12T19:53:02,50.0,0.0,15.0
1301,02/12/2020,,Thailand,2020-02-11T18:43:04,33.0,0.0,10.0
1302,02/12/2020,,Japan,2020-02-12T02:43:03,28.0,0.0,9.0
1303,02/12/2020,,South Korea,2020-02-12T14:43:03,28.0,0.0,7.0
1304,02/12/2020,Qinghai,Mainland China,2020-02-12T08:03:06,18.0,0.0,9.0
1305,02/12/2020,,Malaysia,2020-02-11T03:13:13,18.0,0.0,3.0
1306,02/12/2020,Taiwan,Taiwan,2020-02-09T09:13:11,18.0,0.0,1.0
1307,02/12/2020,,Germany,2020-02-11T19:33:03,16.0,0.0,0.0
1308,02/12/2020,,Vietnam,2020-02-11T16:43:06,15.0,0.0,6.0
1309,02/12/2020,,France,2020-02-12T18:53:02,11.0,0.0,2.0
1310,02/12/2020,Macau,Macau,2020-02-12T09:53:02,10.0,0.0,2.0
1311,02/12/2020,,UK,2020-02-12T19:03:06,9.0,0.0,1.0
1312,02/12/2020,,United Arab Emirates,2020-02-12T00:33:02,8.0,0.0,1.0
1313,02/12/2020,Queensland,Australia,2020-02-09T19:33:02,5.0,0.0,0.0
1314,02/12/2020,New South Wales,Australia,2020-02-06T03:13:22,4.0,0.0,2.0
1315,02/12/2020,Victoria,Australia,2020-02-01T18:12:49,4.0,0.0,0.0
1316,02/12/2020,British Columbia,Canada,2020-02-07T05:43:03,4.0,0.0,0.0
1317,02/12/2020,,India,2020-02-03T21:43:02,3.0,0.0,0.0
1318,02/12/2020,,Italy,2020-02-07T17:53:02,3.0,0.0,0.0
1319,02/12/2020,,Philippines,2020-02-12T07:43:02,3.0,1.0,1.0
1320,02/12/2020,South Australia,Australia,2020-02-02T22:33:07,2.0,0.0,0.0
1321,02/12/2020,"Toronto, ON",Canada,2020-02-04T00:13:06,2.0,0.0,0.0
1322,02/12/2020,,Russia,2020-02-12T14:43:03,2.0,0.0,2.0
1323,02/12/2020,,Spain,2020-02-09T20:33:03,2.0,0.0,0.0
1324,02/12/2020,"Chicago, IL",US,2020-02-09T19:03:03,2.0,0.0,2.0
1325,02/12/2020,"San Benito, CA",US,2020-02-03T03:53:02,2.0,0.0,0.0
1326,02/12/2020,"Santa Clara, CA",US,2020-02-03T00:43:02,2.0,0.0,0.0
1327,02/12/2020,,Belgium,2020-02-04T15:43:02,1.0,0.0,0.0
1328,02/12/2020,,Cambodia,2020-02-12T07:43:02,1.0,0.0,1.0
1329,02/12/2020,"London, ON",Canada,2020-02-12T18:53:03,1.0,0.0,1.0
1330,02/12/2020,,Finland,2020-02-12T00:03:12,1.0,0.0,1.0
1331,02/12/2020,Tibet,Mainland China,2020-02-12T06:43:02,1.0,0.0,1.0
1332,02/12/2020,,Nepal,2020-02-12T14:43:03,1.0,0.0,1.0
1333,02/12/2020,,Sri Lanka,2020-02-08T03:43:03,1.0,0.0,1.0
1334,02/12/2020,,Sweden,2020-02-01T02:13:26,1.0,0.0,0.0
1335,02/12/2020,"Boston, MA",US,2020-02-01T19:43:03,1.0,0.0,0.0
1336,02/12/2020,"Los Angeles, CA",US,2020-02-01T19:53:03,1.0,0.0,0.0
1337,02/12/2020,"Madison, WI",US,2020-02-05T21:53:02,1.0,0.0,0.0
1338,02/12/2020,"Orange, CA",US,2020-02-01T19:53:03,1.0,0.0,0.0
1339,02/12/2020,"San Diego County, CA",US,2020-02-11T01:23:05,1.0,0.0,0.0
1340,02/12/2020,"Seattle, WA",US,2020-02-09T07:03:04,1.0,0.0,1.0
1341,02/12/2020,"Tempe, AZ",US,2020-02-01T19:43:03,1.0,0.0,0.0
1342,02/13/2020,Hubei,Mainland China,2020-02-13T14:13:06,48206.0,1310.0,3459.0
1343,02/13/2020,Guangdong,Mainland China,2020-02-13T13:33:01,1241.0,2.0,314.0
1344,02/13/2020,Henan,Mainland China,2020-02-13T14:53:02,1169.0,10.0,296.0
1345,02/13/2020,Zhejiang,Mainland China,2020-02-13T14:13:06,1145.0,0.0,360.0
1346,02/13/2020,Hunan,Mainland China,2020-02-13T11:53:02,968.0,2.0,339.0
1347,02/13/2020,Anhui,Mainland China,2020-02-13T13:33:01,910.0,5.0,157.0
1348,02/13/2020,Jiangxi,Mainland China,2020-02-13T01:13:08,872.0,1.0,170.0
1349,02/13/2020,Jiangsu,Mainland China,2020-02-13T10:33:23,570.0,0.0,139.0
1350,02/13/2020,Chongqing,Mainland China,2020-02-13T23:23:05,529.0,4.0,128.0
1351,02/13/2020,Shandong,Mainland China,2020-02-13T13:33:01,509.0,2.0,105.0
1352,02/13/2020,Sichuan,Mainland China,2020-02-13T13:33:01,451.0,1.0,104.0
1353,02/13/2020,Heilongjiang,Mainland China,2020-02-13T12:13:06,395.0,9.0,33.0
1354,02/13/2020,Beijing,Mainland China,2020-02-13T14:13:06,366.0,3.0,69.0
1355,02/13/2020,Shanghai,Mainland China,2020-02-13T06:13:15,315.0,1.0,62.0
1356,02/13/2020,Fujian,Mainland China,2020-02-13T10:33:23,279.0,0.0,57.0
1357,02/13/2020,Hebei,Mainland China,2020-02-13T10:33:23,265.0,3.0,68.0
1358,02/13/2020,Shaanxi,Mainland China,2020-02-13T10:33:23,229.0,0.0,46.0
1359,02/13/2020,Guangxi,Mainland China,2020-02-13T00:23:10,222.0,2.0,33.0
1360,02/13/2020,Diamond Princess cruise ship,Others,2020-02-12T04:23:38,175.0,0.0,0.0
1361,02/13/2020,Hainan,Mainland China,2020-02-13T10:43:03,157.0,4.0,30.0
1362,02/13/2020,Yunnan,Mainland China,2020-02-13T08:43:08,156.0,0.0,27.0
1363,02/13/2020,Guizhou,Mainland China,2020-02-13T10:33:23,135.0,1.0,27.0
1364,02/13/2020,Shanxi,Mainland China,2020-02-13T23:23:05,126.0,0.0,36.0
1365,02/13/2020,Tianjin,Mainland China,2020-02-13T23:43:02,119.0,3.0,21.0
1366,02/13/2020,Liaoning,Mainland China,2020-02-13T14:33:02,117.0,1.0,22.0
1367,02/13/2020,Gansu,Mainland China,2020-02-13T15:53:03,90.0,2.0,39.0
1368,02/13/2020,Jilin,Mainland China,2020-02-13T13:33:01,84.0,1.0,24.0
1369,02/13/2020,Ningxia,Mainland China,2020-02-13T01:23:08,64.0,0.0,24.0
1370,02/13/2020,Xinjiang,Mainland China,2020-02-13T10:33:23,63.0,1.0,6.0
1371,02/13/2020,Inner Mongolia,Mainland China,2020-02-13T01:23:08,61.0,0.0,6.0
1372,02/13/2020,,Singapore,2020-02-13T14:33:02,58.0,0.0,15.0
1373,02/13/2020,Hong Kong,Hong Kong,2020-02-13T14:53:02,53.0,1.0,1.0
1374,02/13/2020,,Thailand,2020-02-13T17:53:03,33.0,0.0,12.0
1375,02/13/2020,,Japan,2020-02-13T12:23:05,28.0,1.0,9.0
1376,02/13/2020,,South Korea,2020-02-12T14:43:03,28.0,0.0,7.0
1377,02/13/2020,,Malaysia,2020-02-13T10:53:02,19.0,0.0,3.0
1378,02/13/2020,Qinghai,Mainland China,2020-02-13T08:43:08,18.0,0.0,11.0
1379,02/13/2020,Taiwan,Taiwan,2020-02-09T09:13:11,18.0,0.0,1.0
1380,02/13/2020,,Germany,2020-02-13T15:13:11,16.0,0.0,1.0
1381,02/13/2020,,Vietnam,2020-02-13T06:33:02,16.0,0.0,7.0
1382,02/13/2020,,France,2020-02-12T18:53:02,11.0,0.0,2.0
1383,02/13/2020,Macau,Macau,2020-02-13T14:13:06,10.0,0.0,3.0
1384,02/13/2020,,UK,2020-02-12T19:03:06,9.0,0.0,1.0
1385,02/13/2020,,United Arab Emirates,2020-02-12T00:33:02,8.0,0.0,1.0
1386,02/13/2020,Queensland,Australia,2020-02-09T19:33:02,5.0,0.0,0.0
1387,02/13/2020,New South Wales,Australia,2020-02-13T17:53:03,4.0,0.0,4.0
1388,02/13/2020,Victoria,Australia,2020-02-13T17:53:03,4.0,0.0,4.0
1389,02/13/2020,British Columbia,Canada,2020-02-07T05:43:03,4.0,0.0,0.0
1390,02/13/2020,,India,2020-02-13T18:53:02,3.0,0.0,0.0
1391,02/13/2020,,Italy,2020-02-07T17:53:02,3.0,0.0,0.0
1392,02/13/2020,,Philippines,2020-02-12T07:43:02,3.0,1.0,1.0
1393,02/13/2020,South Australia,Australia,2020-02-02T22:33:07,2.0,0.0,0.0
1394,02/13/2020,"Toronto, ON",Canada,2020-02-04T00:13:06,2.0,0.0,0.0
1395,02/13/2020,,Russia,2020-02-12T14:43:03,2.0,0.0,2.0
1396,02/13/2020,,Spain,2020-02-09T20:33:03,2.0,0.0,0.0
1397,02/13/2020,"Chicago, IL",US,2020-02-09T19:03:03,2.0,0.0,2.0
1398,02/13/2020,"San Benito, CA",US,2020-02-03T03:53:02,2.0,0.0,0.0
1399,02/13/2020,"San Diego County, CA",US,2020-02-13T03:13:08,2.0,0.0,0.0
1400,02/13/2020,"Santa Clara, CA",US,2020-02-03T00:43:02,2.0,0.0,0.0
1401,02/13/2020,,Belgium,2020-02-04T15:43:02,1.0,0.0,0.0
1402,02/13/2020,,Cambodia,2020-02-12T07:43:02,1.0,0.0,1.0
1403,02/13/2020,"London, ON",Canada,2020-02-12T18:53:03,1.0,0.0,1.0
1404,02/13/2020,,Finland,2020-02-12T00:03:12,1.0,0.0,1.0
1405,02/13/2020,Tibet,Mainland China,2020-02-12T06:43:02,1.0,0.0,1.0
1406,02/13/2020,,Nepal,2020-02-12T14:43:03,1.0,0.0,1.0
1407,02/13/2020,,Sri Lanka,2020-02-08T03:43:03,1.0,0.0,1.0
1408,02/13/2020,,Sweden,2020-02-01T02:13:26,1.0,0.0,0.0
1409,02/13/2020,"Boston, MA",US,2020-02-01T19:43:03,1.0,0.0,0.0
1410,02/13/2020,"Los Angeles, CA",US,2020-02-01T19:53:03,1.0,0.0,0.0
1411,02/13/2020,"Madison, WI",US,2020-02-05T21:53:02,1.0,0.0,0.0
1412,02/13/2020,"Orange, CA",US,2020-02-01T19:53:03,1.0,0.0,0.0
1413,02/13/2020,"San Antonio, TX",US,2020-02-13T18:53:02,1.0,0.0,0.0
1414,02/13/2020,"Seattle, WA",US,2020-02-09T07:03:04,1.0,0.0,1.0
1415,02/13/2020,"Tempe, AZ",US,2020-02-01T19:43:03,1.0,0.0,0.0
1416,02/14/2020,Hubei,Mainland China,2020-02-14T23:33:02,54406.0,1457.0,4774.0
1417,02/14/2020,Guangdong,Mainland China,2020-02-14T12:53:02,1261.0,2.0,362.0
1418,02/14/2020,Henan,Mainland China,2020-02-14T12:53:02,1184.0,11.0,357.0
1419,02/14/2020,Zhejiang,Mainland China,2020-02-14T14:13:15,1155.0,0.0,403.0
1420,02/14/2020,Hunan,Mainland China,2020-02-14T09:23:04,988.0,2.0,364.0
1421,02/14/2020,Anhui,Mainland China,2020-02-14T12:53:02,934.0,6.0,193.0
1422,02/14/2020,Jiangxi,Mainland China,2020-02-14T01:13:06,900.0,1.0,187.0
1423,02/14/2020,Jiangsu,Mainland China,2020-02-14T10:03:03,593.0,0.0,157.0
1424,02/14/2020,Chongqing,Mainland China,2020-02-14T23:33:02,537.0,5.0,152.0
1425,02/14/2020,Shandong,Mainland China,2020-02-14T11:13:22,523.0,2.0,136.0
1426,02/14/2020,Sichuan,Mainland China,2020-02-14T11:13:22,463.0,1.0,114.0
1427,02/14/2020,Heilongjiang,Mainland China,2020-02-14T13:23:07,419.0,11.0,47.0
1428,02/14/2020,Beijing,Mainland China,2020-02-14T06:33:02,372.0,3.0,80.0
1429,02/14/2020,Shanghai,Mainland China,2020-02-14T04:13:11,318.0,1.0,90.0
1430,02/14/2020,Hebei,Mainland China,2020-02-14T11:13:22,283.0,3.0,87.0
1431,02/14/2020,Fujian,Mainland China,2020-02-14T11:13:22,281.0,0.0,63.0
1432,02/14/2020,Shaanxi,Mainland China,2020-02-14T12:53:02,230.0,0.0,54.0
1433,02/14/2020,Guangxi,Mainland China,2020-02-14T15:23:02,226.0,2.0,36.0
1434,02/14/2020,Diamond Princess cruise ship,Others,2020-02-14T00:13:23,218.0,0.0,0.0
1435,02/14/2020,Yunnan,Mainland China,2020-02-14T12:53:02,162.0,0.0,36.0
1436,02/14/2020,Hainan,Mainland China,2020-02-14T15:23:02,159.0,4.0,43.0
1437,02/14/2020,Guizhou,Mainland China,2020-02-14T01:53:02,140.0,1.0,28.0
1438,02/14/2020,Shanxi,Mainland China,2020-02-14T23:23:04,127.0,0.0,38.0
1439,02/14/2020,Tianjin,Mainland China,2020-02-14T11:13:22,120.0,3.0,31.0
1440,02/14/2020,Liaoning,Mainland China,2020-02-14T15:23:02,119.0,1.0,29.0
1441,02/14/2020,Gansu,Mainland China,2020-02-13T15:53:03,90.0,2.0,39.0
1442,02/14/2020,Jilin,Mainland China,2020-02-14T00:43:02,86.0,1.0,25.0
1443,02/14/2020,Ningxia,Mainland China,2020-02-14T01:43:02,67.0,0.0,24.0
1444,02/14/2020,,Singapore,2020-02-14T12:43:02,67.0,0.0,17.0
1445,02/14/2020,Inner Mongolia,Mainland China,2020-02-14T02:03:08,65.0,0.0,6.0
1446,02/14/2020,Xinjiang,Mainland China,2020-02-14T01:13:06,65.0,1.0,6.0
1447,02/14/2020,Hong Kong,Hong Kong,2020-02-14T09:03:12,56.0,1.0,1.0
1448,02/14/2020,,Thailand,2020-02-13T17:53:03,33.0,0.0,12.0
1449,02/14/2020,,Japan,2020-02-14T03:53:02,29.0,1.0,9.0
1450,02/14/2020,,South Korea,2020-02-12T14:43:03,28.0,0.0,7.0
1451,02/14/2020,,Malaysia,2020-02-13T10:53:02,19.0,0.0,3.0
1452,02/14/2020,Qinghai,Mainland China,2020-02-13T08:43:08,18.0,0.0,11.0
1453,02/14/2020,Taiwan,Taiwan,2020-02-14T02:13:06,18.0,0.0,2.0
1454,02/14/2020,,Germany,2020-02-13T15:13:11,16.0,0.0,1.0
1455,02/14/2020,,Vietnam,2020-02-13T06:33:02,16.0,0.0,7.0
1456,02/14/2020,,France,2020-02-12T18:53:02,11.0,0.0,2.0
1457,02/14/2020,Macau,Macau,2020-02-13T14:13:06,10.0,0.0,3.0
1458,02/14/2020,,UK,2020-02-12T19:03:06,9.0,0.0,1.0
1459,02/14/2020,,United Arab Emirates,2020-02-12T00:33:02,8.0,0.0,1.0
1460,02/14/2020,Queensland,Australia,2020-02-09T19:33:02,5.0,0.0,0.0
1461,02/14/2020,New South Wales,Australia,2020-02-13T17:53:03,4.0,0.0,4.0
1462,02/14/2020,Victoria,Australia,2020-02-13T17:53:03,4.0,0.0,4.0
1463,02/14/2020,British Columbia,Canada,2020-02-07T05:43:03,4.0,0.0,0.0
1464,02/14/2020,,India,2020-02-13T18:53:02,3.0,0.0,0.0
1465,02/14/2020,,Italy,2020-02-07T17:53:02,3.0,0.0,0.0
1466,02/14/2020,,Philippines,2020-02-12T07:43:02,3.0,1.0,1.0
1467,02/14/2020,South Australia,Australia,2020-02-02T22:33:07,2.0,0.0,0.0
1468,02/14/2020,"Toronto, ON",Canada,2020-02-04T00:13:06,2.0,0.0,0.0
1469,02/14/2020,,Russia,2020-02-12T14:43:03,2.0,0.0,2.0
1470,02/14/2020,,Spain,2020-02-09T20:33:03,2.0,0.0,0.0
1471,02/14/2020,"Chicago, IL",US,2020-02-09T19:03:03,2.0,0.0,2.0
1472,02/14/2020,"San Benito, CA",US,2020-02-03T03:53:02,2.0,0.0,0.0
1473,02/14/2020,"San Diego County, CA",US,2020-02-13T03:13:08,2.0,0.0,0.0
1474,02/14/2020,"Santa Clara, CA",US,2020-02-03T00:43:02,2.0,0.0,0.0
1475,02/14/2020,,Belgium,2020-02-04T15:43:02,1.0,0.0,0.0
1476,02/14/2020,,Cambodia,2020-02-12T07:43:02,1.0,0.0,1.0
1477,02/14/2020,"London, ON",Canada,2020-02-12T18:53:03,1.0,0.0,1.0
1478,02/14/2020,,Egypt,2020-02-14T23:53:02,1.0,0.0,0.0
1479,02/14/2020,,Finland,2020-02-12T00:03:12,1.0,0.0,1.0
1480,02/14/2020,Tibet,Mainland China,2020-02-12T06:43:02,1.0,0.0,1.0
1481,02/14/2020,,Nepal,2020-02-12T14:43:03,1.0,0.0,1.0
1482,02/14/2020,,Sri Lanka,2020-02-08T03:43:03,1.0,0.0,1.0
1483,02/14/2020,,Sweden,2020-02-01T02:13:26,1.0,0.0,0.0
1484,02/14/2020,"Boston, MA",US,2020-02-01T19:43:03,1.0,0.0,0.0
1485,02/14/2020,"Los Angeles, CA",US,2020-02-01T19:53:03,1.0,0.0,0.0
1486,02/14/2020,"Madison, WI",US,2020-02-05T21:53:02,1.0,0.0,0.0
1487,02/14/2020,"Orange, CA",US,2020-02-01T19:53:03,1.0,0.0,0.0
1488,02/14/2020,"San Antonio, TX",US,2020-02-13T18:53:02,1.0,0.0,0.0
1489,02/14/2020,"Seattle, WA",US,2020-02-09T07:03:04,1.0,0.0,1.0
1490,02/14/2020,"Tempe, AZ",US,2020-02-01T19:43:03,1.0,0.0,0.0
1491,02/15/2020,Hubei,Mainland China,2020-02-15T23:13:05,56249.0,1596.0,5623.0
1492,02/15/2020,Guangdong,Mainland China,2020-02-15T14:03:04,1294.0,2.0,410.0
1493,02/15/2020,Henan,Mainland China,2020-02-15T12:13:08,1212.0,13.0,391.0
1494,02/15/2020,Zhejiang,Mainland China,2020-02-15T11:23:17,1162.0,0.0,428.0
1495,02/15/2020,Hunan,Mainland China,2020-02-15T13:03:04,1001.0,2.0,425.0
1496,02/15/2020,Anhui,Mainland China,2020-02-15T12:13:08,950.0,6.0,221.0
1497,02/15/2020,Jiangxi,Mainland China,2020-02-15T01:33:02,913.0,1.0,210.0
1498,02/15/2020,Jiangsu,Mainland China,2020-02-15T12:13:08,604.0,0.0,186.0
1499,02/15/2020,Chongqing,Mainland China,2020-02-15T23:23:07,544.0,5.0,184.0
1500,02/15/2020,Shandong,Mainland China,2020-02-15T11:23:17,532.0,2.0,156.0
1501,02/15/2020,Sichuan,Mainland China,2020-02-15T08:43:03,470.0,1.0,119.0
1502,02/15/2020,Heilongjiang,Mainland China,2020-02-15T11:43:01,425.0,11.0,68.0
1503,02/15/2020,Beijing,Mainland China,2020-02-15T09:53:01,375.0,4.0,98.0
1504,02/15/2020,Shanghai,Mainland China,2020-02-15T03:13:06,326.0,1.0,124.0
1505,02/15/2020,Hebei,Mainland China,2020-02-15T13:03:04,291.0,3.0,101.0
1506,02/15/2020,Fujian,Mainland China,2020-02-15T13:03:04,285.0,0.0,71.0
1507,02/15/2020,Diamond Princess cruise ship,Others,2020-02-15T17:03:04,285.0,0.0,0.0
1508,02/15/2020,Guangxi,Mainland China,2020-02-15T06:33:01,235.0,2.0,44.0
1509,02/15/2020,Shaanxi,Mainland China,2020-02-15T12:13:08,232.0,0.0,60.0
1510,02/15/2020,Yunnan,Mainland China,2020-02-15T06:33:01,168.0,0.0,42.0
1511,02/15/2020,Hainan,Mainland China,2020-02-15T11:23:17,162.0,4.0,39.0
1512,02/15/2020,Guizhou,Mainland China,2020-02-15T14:53:04,143.0,1.0,41.0
1513,02/15/2020,Shanxi,Mainland China,2020-02-15T23:13:05,128.0,0.0,46.0
1514,02/15/2020,Tianjin,Mainland China,2020-02-15T13:43:01,122.0,3.0,37.0
1515,02/15/2020,Liaoning,Mainland China,2020-02-15T09:53:01,119.0,1.0,31.0
1516,02/15/2020,Gansu,Mainland China,2020-02-15T12:13:08,90.0,2.0,49.0
1517,02/15/2020,Jilin,Mainland China,2020-02-15T12:13:08,88.0,1.0,26.0
1518,02/15/2020,,Singapore,2020-02-15T23:53:02,72.0,0.0,18.0
1519,02/15/2020,Ningxia,Mainland China,2020-02-15T08:43:03,70.0,0.0,33.0
1520,02/15/2020,Xinjiang,Mainland China,2020-02-15T09:53:01,70.0,1.0,10.0
1521,02/15/2020,Inner Mongolia,Mainland China,2020-02-15T14:03:04,68.0,0.0,7.0
1522,02/15/2020,Hong Kong,Hong Kong,2020-02-14T09:03:12,56.0,1.0,1.0
1523,02/15/2020,,Japan,2020-02-15T17:43:06,43.0,1.0,12.0
1524,02/15/2020,,Thailand,2020-02-13T17:53:03,33.0,0.0,12.0
1525,02/15/2020,,South Korea,2020-02-15T23:33:02,28.0,0.0,9.0
1526,02/15/2020,,Malaysia,2020-02-15T23:43:02,22.0,0.0,7.0
1527,02/15/2020,Qinghai,Mainland China,2020-02-15T08:43:03,18.0,0.0,13.0
1528,02/15/2020,Taiwan,Taiwan,2020-02-15T03:43:02,18.0,0.0,2.0
1529,02/15/2020,,Germany,2020-02-13T15:13:11,16.0,0.0,1.0
1530,02/15/2020,,Vietnam,2020-02-13T06:33:02,16.0,0.0,7.0
1531,02/15/2020,,France,2020-02-15T20:53:02,12.0,1.0,4.0
1532,02/15/2020,Macau,Macau,2020-02-13T14:13:06,10.0,0.0,3.0
1533,02/15/2020,,UK,2020-02-12T19:03:06,9.0,0.0,1.0
1534,02/15/2020,,United Arab Emirates,2020-02-15T06:03:03,8.0,0.0,3.0
1535,02/15/2020,Queensland,Australia,2020-02-09T19:33:02,5.0,0.0,0.0
1536,02/15/2020,New South Wales,Australia,2020-02-13T17:53:03,4.0,0.0,4.0
1537,02/15/2020,Victoria,Australia,2020-02-13T17:53:03,4.0,0.0,4.0
1538,02/15/2020,British Columbia,Canada,2020-02-07T05:43:03,4.0,0.0,0.0
1539,02/15/2020,,India,2020-02-13T18:53:02,3.0,0.0,0.0
1540,02/15/2020,,Italy,2020-02-07T17:53:02,3.0,0.0,0.0
